[
  {
    "url": "https://gundogsdirect.co.uk/dogs-for-sale/cocker-spaniels-for-sale/trained-cocker-spaniels/31141",
    "id": "31141",
    "platform": "gundogs_direct",
    "scraped_at": "2026-01-24T20:34:42.061094",
    "title": "\ud83d\udc36 Buyer\u2019s Checklist for Gun Dogs",
    "breed": "Cocker Spaniels",
    "price": "6000",
    "posted_date": "24-01-2026",
    "posted_date_iso": "2026-01-24",
    "last_updated": "24-01-2026",
    "location": "Clevedon",
    "seller_name": "Carlengeo Gundogs",
    "member_since": "30th April 2024",
    "verified_breeder": false,
    "health_checked": true,
    "hip_scored": false,
    "elbow_scored": false,
    "eye_tested": false,
    "vaccinated": false,
    "microchipped": false,
    "wormed": true,
    "kc_registered": false,
    "original_breeder": false,
    "viewable_with_mother": false
  },
  {
    "url": "https://gundogsdirect.co.uk/dogs-for-sale/labradors-for-sale/labrador-puppies-for-sale/30956",
    "id": "30956",
    "platform": "gundogs_direct",
    "scraped_at": "2026-01-24T20:34:44.702913",
    "title": "\ud83d\udc36 Buyer\u2019s Checklist for Gun Dogs",
    "breed": "Labradors",
    "price": "1550",
    "posted_date": "18-12-2025",
    "posted_date_iso": "2025-12-18",
    "last_updated": "24-01-2026",
    "litter_size": 7,
    "available_puppies": 2,
    "date_of_birth": "15 Dec 2025",
    "location": "Battle",
    "seller_name": "C&S Tompsett",
    "member_since": "30th April 2024",
    "verified_breeder": false,
    "health_checked": true,
    "hip_scored": false,
    "elbow_scored": false,
    "eye_tested": false,
    "vaccinated": false,
    "microchipped": false,
    "wormed": true,
    "kc_registered": false,
    "original_breeder": true,
    "viewable_with_mother": true
  },
  {
    "url": "https://gundogsdirect.co.uk/dogs-for-sale/labradors-for-sale/part-trained-labradors/31138",
    "id": "31138",
    "platform": "gundogs_direct",
    "scraped_at": "2026-01-24T20:34:47.111006",
    "title": "\ud83d\udc36 Buyer\u2019s Checklist for Gun Dogs",
    "breed": "Labradors",
    "price": "2600",
    "posted_date": "24-01-2026",
    "posted_date_iso": "2026-01-24",
    "last_updated": "24-01-2026",
    "location": "Swansea",
    "seller_name": "Richard Longman",
    "member_since": "9th January 2026",
    "verified_breeder": false,
    "health_checked": false,
    "hip_scored": false,
    "elbow_scored": false,
    "eye_tested": false,
    "vaccinated": false,
    "microchipped": false,
    "wormed": true,
    "kc_registered": false,
    "original_breeder": false,
    "viewable_with_mother": false
  },
  {
    "url": "https://gundogsdirect.co.uk/dogs-for-sale/springer-spaniels-for-sale/springer-spaniel-puppies/31137",
    "id": "31137",
    "platform": "gundogs_direct",
    "scraped_at": "2026-01-24T20:34:49.509306",
    "title": "\ud83d\udc36 Buyer\u2019s Checklist for Gun Dogs",
    "breed": "Springer Spaniels",
    "price": "950",
    "posted_date": "24-01-2026",
    "posted_date_iso": "2026-01-24",
    "last_updated": "24-01-2026",
    "date_of_birth": "10 Jan 2026",
    "location": "Tadley",
    "seller_name": "Shannon Mcgarrigle",
    "member_since": "20th December 2024",
    "verified_breeder": false,
    "health_checked": false,
    "hip_scored": false,
    "elbow_scored": false,
    "eye_tested": false,
    "vaccinated": false,
    "microchipped": false,
    "wormed": true,
    "kc_registered": false,
    "original_breeder": true,
    "viewable_with_mother": true
  },
  {
    "url": "https://gundogsdirect.co.uk/dogs-for-sale/cocker-spaniels-for-sale/cocker-spaniel-puppies/31016",
    "id": "31016",
    "platform": "gundogs_direct",
    "scraped_at": "2026-01-24T20:34:52.056167",
    "title": "\ud83d\udc36 Buyer\u2019s Checklist for Gun Dogs",
    "breed": "Cocker Spaniels",
    "price": "1500",
    "posted_date": "01-01-2026",
    "posted_date_iso": "2026-01-01",
    "last_updated": "24-01-2026",
    "available_puppies": 9,
    "date_of_birth": "17 Dec 2025",
    "ready_to_leave": "11th February",
    "age": "2",
    "location": "Middlewich",
    "seller_name": "Dennis Kelly",
    "member_since": "8th October 2024",
    "verified_breeder": false,
    "health_checked": true,
    "hip_scored": false,
    "elbow_scored": false,
    "eye_tested": false,
    "vaccinated": false,
    "microchipped": false,
    "wormed": true,
    "kc_registered": false,
    "original_breeder": true,
    "viewable_with_mother": true
  },
  {
    "url": "https://gundogsdirect.co.uk/dogs-for-sale/springer-spaniels-for-sale/springer-spaniel-puppies/31055",
    "id": "31055",
    "platform": "gundogs_direct",
    "scraped_at": "2026-01-24T20:34:54.626402",
    "title": "\ud83d\udc36 Buyer\u2019s Checklist for Gun Dogs",
    "breed": "Springer Spaniels",
    "price": "950",
    "posted_date": "08-01-2026",
    "posted_date_iso": "2026-01-08",
    "last_updated": "24-01-2026",
    "date_of_birth": "26 Nov 2025",
    "location": "Hexham",
    "seller_name": "Susan Tweedie",
    "member_since": "8th January 2026",
    "verified_breeder": false,
    "health_checked": true,
    "hip_scored": false,
    "elbow_scored": false,
    "eye_tested": false,
    "vaccinated": false,
    "microchipped": false,
    "wormed": true,
    "kc_registered": false,
    "original_breeder": true,
    "viewable_with_mother": true
  },
  {
    "url": "https://gundogsdirect.co.uk/dogs-for-sale/cocker-spaniels-for-sale/cocker-spaniel-puppies/30924",
    "id": "30924",
    "platform": "gundogs_direct",
    "scraped_at": "2026-01-24T20:34:57.163618",
    "title": "\ud83d\udc36 Buyer\u2019s Checklist for Gun Dogs",
    "breed": "Cocker Spaniels",
    "price": "300",
    "posted_date": "13-12-2025",
    "posted_date_iso": "2025-12-13",
    "last_updated": "24-01-2026",
    "date_of_birth": "15 Nov 2025",
    "location": "Skegness",
    "seller_name": "claude williams",
    "member_since": "30th April 2024",
    "verified_breeder": false,
    "health_checked": true,
    "hip_scored": false,
    "elbow_scored": false,
    "eye_tested": false,
    "vaccinated": false,
    "microchipped": false,
    "wormed": true,
    "kc_registered": false,
    "original_breeder": true,
    "viewable_with_mother": true
  },
  {
    "url": "https://gundogsdirect.co.uk/dogs-for-sale/cocker-spaniels-for-sale/cocker-spaniel-puppies/31122",
    "id": "31122",
    "platform": "gundogs_direct",
    "scraped_at": "2026-01-24T20:34:59.822049",
    "title": "\ud83d\udc36 Buyer\u2019s Checklist for Gun Dogs",
    "breed": "Cocker Spaniels",
    "price": "1000",
    "posted_date": "20-01-2026",
    "posted_date_iso": "2026-01-20",
    "last_updated": "24-01-2026",
    "date_of_birth": "12 Dec 2025",
    "location": "Bolton",
    "seller_name": "Andrea Emery",
    "member_since": "20th January 2026",
    "verified_breeder": false,
    "health_checked": false,
    "hip_scored": false,
    "elbow_scored": false,
    "eye_tested": false,
    "vaccinated": false,
    "microchipped": false,
    "wormed": true,
    "kc_registered": false,
    "original_breeder": true,
    "viewable_with_mother": true
  },
  {
    "url": "https://gundogsdirect.co.uk/dogs-for-sale/labradors-for-sale/labrador-puppies-for-sale/31056",
    "id": "31056",
    "platform": "gundogs_direct",
    "scraped_at": "2026-01-24T20:35:02.261970",
    "title": "\ud83d\udc36 Buyer\u2019s Checklist for Gun Dogs",
    "breed": "Labradors",
    "price": "800",
    "posted_date": "08-01-2026",
    "posted_date_iso": "2026-01-08",
    "last_updated": "24-01-2026",
    "date_of_birth": "14 Nov 2025",
    "location": "Anglesey",
    "seller_name": "Jeffrey Contad",
    "member_since": "8th January 2026",
    "verified_breeder": false,
    "health_checked": false,
    "hip_scored": false,
    "elbow_scored": false,
    "eye_tested": false,
    "vaccinated": false,
    "microchipped": false,
    "wormed": true,
    "kc_registered": false,
    "original_breeder": true,
    "viewable_with_mother": true
  },
  {
    "url": "https://gundogsdirect.co.uk/dogs-for-sale/cocker-spaniels-for-sale/cocker-spaniel-puppies/31084",
    "id": "31084",
    "platform": "gundogs_direct",
    "scraped_at": "2026-01-24T20:35:04.731325",
    "title": "\ud83d\udc36 Buyer\u2019s Checklist for Gun Dogs",
    "breed": "Cocker Spaniels",
    "price": "100",
    "posted_date": "12-01-2026",
    "posted_date_iso": "2026-01-12",
    "last_updated": "24-01-2026",
    "date_of_birth": "8 Nov 2025",
    "location": "Middlewich",
    "seller_name": "Jayne Kelly",
    "member_since": "12th January 2026",
    "verified_breeder": false,
    "health_checked": false,
    "hip_scored": false,
    "elbow_scored": false,
    "eye_tested": false,
    "vaccinated": false,
    "microchipped": false,
    "wormed": true,
    "kc_registered": false,
    "original_breeder": true,
    "viewable_with_mother": true
  },
  {
    "url": "https://gundogsdirect.co.uk/dogs-for-sale/labradors-for-sale/part-trained-labradors/31123",
    "id": "31123",
    "platform": "gundogs_direct",
    "scraped_at": "2026-01-24T20:35:07.199175",
    "title": "\ud83d\udc36 Buyer\u2019s Checklist for Gun Dogs",
    "breed": "Labradors",
    "price": "2000",
    "posted_date": "20-01-2026",
    "posted_date_iso": "2026-01-20",
    "last_updated": "24-01-2026",
    "date_of_birth": "17 Mar 2024",
    "location": "Rotherham",
    "seller_name": "Lynn Branford",
    "member_since": "30th April 2024",
    "verified_breeder": false,
    "health_checked": true,
    "hip_scored": false,
    "elbow_scored": false,
    "eye_tested": false,
    "vaccinated": false,
    "microchipped": false,
    "wormed": true,
    "kc_registered": false,
    "original_breeder": false,
    "viewable_with_mother": false
  },
  {
    "url": "https://gundogsdirect.co.uk/dogs-for-sale/cocker-spaniels-for-sale/cocker-spaniel-puppies/31120",
    "id": "31120",
    "platform": "gundogs_direct",
    "scraped_at": "2026-01-24T20:35:09.591785",
    "title": "\ud83d\udc36 Buyer\u2019s Checklist for Gun Dogs",
    "breed": "Cocker Spaniels",
    "price": "1500",
    "posted_date": "20-01-2026",
    "posted_date_iso": "2026-01-20",
    "last_updated": "24-01-2026",
    "available_puppies": 1,
    "date_of_birth": "17 Dec 2025",
    "ready_to_leave": "1 red",
    "location": "Clevedon",
    "seller_name": "L F",
    "member_since": "14th March 2025",
    "verified_breeder": false,
    "health_checked": true,
    "hip_scored": false,
    "elbow_scored": false,
    "eye_tested": false,
    "vaccinated": false,
    "microchipped": false,
    "wormed": true,
    "kc_registered": false,
    "original_breeder": true,
    "viewable_with_mother": true
  },
  {
    "url": "https://gundogsdirect.co.uk/dogs-for-sale/cocker-spaniels-for-sale/cocker-spaniel-at-stud/31119",
    "id": "31119",
    "platform": "gundogs_direct",
    "scraped_at": "2026-01-24T20:35:12.129313",
    "title": "\ud83d\udc36 Buyer\u2019s Checklist for Gun Dogs",
    "breed": "Cocker Spaniels",
    "price": "350",
    "posted_date": "20-01-2026",
    "posted_date_iso": "2026-01-20",
    "last_updated": "24-01-2026",
    "location": "Ludlow",
    "seller_name": "Wendy Archer-Gwilliam",
    "member_since": "30th April 2024",
    "verified_breeder": false,
    "health_checked": true,
    "hip_scored": false,
    "elbow_scored": false,
    "eye_tested": false,
    "vaccinated": false,
    "microchipped": false,
    "wormed": true,
    "kc_registered": false,
    "original_breeder": true,
    "viewable_with_mother": false
  },
  {
    "url": "https://gundogsdirect.co.uk/dogs-for-sale/labradors-for-sale/labrador-puppies-for-sale/31040",
    "id": "31040",
    "platform": "gundogs_direct",
    "scraped_at": "2026-01-24T20:35:14.628295",
    "title": "\ud83d\udc36 Buyer\u2019s Checklist for Gun Dogs",
    "breed": "Labradors",
    "price": "1300",
    "posted_date": "06-01-2026",
    "posted_date_iso": "2026-01-06",
    "last_updated": "24-01-2026",
    "date_of_birth": "8 Dec 2025",
    "location": "Duns",
    "seller_name": "Lesley Wilkie",
    "member_since": "14th March 2025",
    "verified_breeder": false,
    "health_checked": true,
    "hip_scored": false,
    "elbow_scored": false,
    "eye_tested": false,
    "vaccinated": false,
    "microchipped": false,
    "wormed": true,
    "kc_registered": false,
    "original_breeder": true,
    "viewable_with_mother": true
  },
  {
    "url": "https://gundogsdirect.co.uk/dogs-for-sale/labradors-for-sale/labrador-puppies-for-sale/30939",
    "id": "30939",
    "platform": "gundogs_direct",
    "scraped_at": "2026-01-24T20:35:17.142791",
    "title": "\ud83d\udc36 Buyer\u2019s Checklist for Gun Dogs",
    "breed": "Labradors",
    "price": "1700",
    "posted_date": "15-12-2025",
    "posted_date_iso": "2025-12-15",
    "last_updated": "24-01-2026",
    "date_of_birth": "23 Oct 2025",
    "location": "Boston",
    "seller_name": "Jamie Ketteringham",
    "member_since": "10th August 2025",
    "verified_breeder": false,
    "health_checked": false,
    "hip_scored": false,
    "elbow_scored": false,
    "eye_tested": false,
    "vaccinated": false,
    "microchipped": false,
    "wormed": true,
    "kc_registered": false,
    "original_breeder": true,
    "viewable_with_mother": true
  },
  {
    "url": "https://gundogsdirect.co.uk/dogs-for-sale/labradors-for-sale/labrador-puppies-for-sale/30967",
    "id": "30967",
    "platform": "gundogs_direct",
    "scraped_at": "2026-01-24T20:35:19.825613",
    "title": "\ud83d\udc36 Buyer\u2019s Checklist for Gun Dogs",
    "breed": "Labradors",
    "price": "1500",
    "posted_date": "20-12-2025",
    "posted_date_iso": "2025-12-20",
    "last_updated": "24-01-2026",
    "available_puppies": 2,
    "date_of_birth": "6 Oct 2025",
    "location": "Andover",
    "seller_name": "Chris Green",
    "member_since": "20th December 2025",
    "verified_breeder": false,
    "health_checked": true,
    "hip_scored": false,
    "elbow_scored": false,
    "eye_tested": false,
    "vaccinated": false,
    "microchipped": false,
    "wormed": true,
    "kc_registered": false,
    "original_breeder": true,
    "viewable_with_mother": true
  },
  {
    "url": "https://gundogsdirect.co.uk/dogs-for-sale/labradors-for-sale/labrador-puppies-for-sale/30958",
    "id": "30958",
    "platform": "gundogs_direct",
    "scraped_at": "2026-01-24T20:35:22.344459",
    "title": "\ud83d\udc36 Buyer\u2019s Checklist for Gun Dogs",
    "breed": "Labradors",
    "price": "1500",
    "posted_date": "18-12-2025",
    "posted_date_iso": "2025-12-18",
    "last_updated": "24-01-2026",
    "date_of_birth": "25 Nov 2025",
    "location": "Milton Keynes",
    "seller_name": "George Galloway",
    "member_since": "18th December 2025",
    "verified_breeder": false,
    "health_checked": true,
    "hip_scored": false,
    "elbow_scored": false,
    "eye_tested": false,
    "vaccinated": false,
    "microchipped": false,
    "wormed": true,
    "kc_registered": false,
    "original_breeder": true,
    "viewable_with_mother": true
  },
  {
    "url": "https://gundogsdirect.co.uk/dogs-for-sale/labradors-for-sale/labrador-puppies-for-sale/30999",
    "id": "30999",
    "platform": "gundogs_direct",
    "scraped_at": "2026-01-24T20:35:24.879989",
    "title": "\ud83d\udc36 Buyer\u2019s Checklist for Gun Dogs",
    "breed": "Labradors",
    "price": "1850",
    "posted_date": "28-12-2025",
    "posted_date_iso": "2025-12-28",
    "last_updated": "24-01-2026",
    "date_of_birth": "19 Dec 2025",
    "location": "Lockerbie",
    "seller_name": "Kay Cook",
    "member_since": "30th April 2024",
    "verified_breeder": false,
    "health_checked": false,
    "hip_scored": false,
    "elbow_scored": false,
    "eye_tested": false,
    "vaccinated": false,
    "microchipped": false,
    "wormed": true,
    "kc_registered": false,
    "original_breeder": true,
    "viewable_with_mother": true
  },
  {
    "url": "https://gundogsdirect.co.uk/dogs-for-sale/labradors-for-sale/labrador-puppies-for-sale/30973",
    "id": "30973",
    "platform": "gundogs_direct",
    "scraped_at": "2026-01-24T20:35:27.235139",
    "title": "\ud83d\udc36 Buyer\u2019s Checklist for Gun Dogs",
    "breed": "Labradors",
    "price": "900",
    "posted_date": "21-12-2025",
    "posted_date_iso": "2025-12-21",
    "last_updated": "24-01-2026",
    "date_of_birth": "9 Nov 2025",
    "location": "Leicester",
    "seller_name": "Michael Cato",
    "member_since": "1st September 2024",
    "verified_breeder": false,
    "health_checked": false,
    "hip_scored": false,
    "elbow_scored": false,
    "eye_tested": false,
    "vaccinated": false,
    "microchipped": false,
    "wormed": true,
    "kc_registered": false,
    "original_breeder": true,
    "viewable_with_mother": true
  },
  {
    "url": "https://gundogsdirect.co.uk/dogs-for-sale/labradors-for-sale/labrador-puppies-for-sale/31019",
    "id": "31019",
    "platform": "gundogs_direct",
    "scraped_at": "2026-01-24T20:35:29.692739",
    "title": "\ud83d\udc36 Buyer\u2019s Checklist for Gun Dogs",
    "breed": "Labradors",
    "price": "0",
    "posted_date": "01-01-2026",
    "posted_date_iso": "2026-01-01",
    "last_updated": "24-01-2026",
    "date_of_birth": "22 Dec 2025",
    "location": "North West",
    "seller_name": "Emma Bowen",
    "member_since": "12th December 2024",
    "verified_breeder": false,
    "health_checked": false,
    "hip_scored": false,
    "elbow_scored": false,
    "eye_tested": false,
    "vaccinated": false,
    "microchipped": false,
    "wormed": true,
    "kc_registered": false,
    "original_breeder": true,
    "viewable_with_mother": true
  },
  {
    "url": "https://gundogsdirect.co.uk/dogs-for-sale/cocker-spaniels-for-sale/cocker-spaniel-puppies/31110",
    "id": "31110",
    "platform": "gundogs_direct",
    "scraped_at": "2026-01-24T20:35:32.145711",
    "title": "\ud83d\udc36 Buyer\u2019s Checklist for Gun Dogs",
    "breed": "Cocker Spaniels",
    "price": "850",
    "posted_date": "18-01-2026",
    "posted_date_iso": "2026-01-18",
    "last_updated": "24-01-2026",
    "location": "Guisborough",
    "seller_name": "Connor Drury",
    "member_since": "12th July 2024",
    "verified_breeder": false,
    "health_checked": true,
    "hip_scored": false,
    "elbow_scored": false,
    "eye_tested": false,
    "vaccinated": false,
    "microchipped": false,
    "wormed": true,
    "kc_registered": false,
    "original_breeder": true,
    "viewable_with_mother": true
  },
  {
    "url": "https://gundogsdirect.co.uk/dogs-for-sale/springer-spaniels-for-sale/springer-spaniel-puppies/31108",
    "id": "31108",
    "platform": "gundogs_direct",
    "scraped_at": "2026-01-24T20:35:34.625536",
    "title": "\ud83d\udc36 Buyer\u2019s Checklist for Gun Dogs",
    "breed": "Springer Spaniels",
    "price": "1200",
    "posted_date": "18-01-2026",
    "posted_date_iso": "2026-01-18",
    "last_updated": "24-01-2026",
    "date_of_birth": "28 Nov 2025",
    "location": "Wadhurst",
    "seller_name": "Ben Hatton",
    "member_since": "18th January 2026",
    "verified_breeder": false,
    "health_checked": true,
    "hip_scored": false,
    "elbow_scored": false,
    "eye_tested": false,
    "vaccinated": false,
    "microchipped": false,
    "wormed": true,
    "kc_registered": false,
    "original_breeder": true,
    "viewable_with_mother": true
  },
  {
    "url": "https://gundogsdirect.co.uk/dogs-for-sale/cocker-spaniels-for-sale/cocker-spaniel-puppies/31062",
    "id": "31062",
    "platform": "gundogs_direct",
    "scraped_at": "2026-01-24T20:35:37.075900",
    "title": "\ud83d\udc36 Buyer\u2019s Checklist for Gun Dogs",
    "breed": "Cocker Spaniels",
    "price": "1500",
    "posted_date": "09-01-2026",
    "posted_date_iso": "2026-01-09",
    "last_updated": "24-01-2026",
    "date_of_birth": "30 Dec 2025",
    "ready_to_leave": "24th Feb",
    "location": "Norfolk",
    "seller_name": "Naomi Harrowven",
    "member_since": "27th February 2025",
    "verified_breeder": false,
    "health_checked": true,
    "hip_scored": false,
    "elbow_scored": false,
    "eye_tested": false,
    "vaccinated": false,
    "microchipped": false,
    "wormed": true,
    "kc_registered": false,
    "original_breeder": true,
    "viewable_with_mother": true
  },
  {
    "url": "https://gundogsdirect.co.uk/dogs-for-sale/cocker-spaniels-for-sale/trained-cocker-spaniels/31096",
    "id": "31096",
    "platform": "gundogs_direct",
    "scraped_at": "2026-01-24T20:35:39.526975",
    "title": "\ud83d\udc36 Buyer\u2019s Checklist for Gun Dogs",
    "breed": "Cocker Spaniels",
    "price": "3500",
    "posted_date": "15-01-2026",
    "posted_date_iso": "2026-01-15",
    "last_updated": "24-01-2026",
    "date_of_birth": "23 May 2023",
    "location": "Clevedon",
    "seller_name": "Benjamin Wright",
    "member_since": "8th July 2024",
    "verified_breeder": false,
    "health_checked": false,
    "hip_scored": false,
    "elbow_scored": false,
    "eye_tested": false,
    "vaccinated": false,
    "microchipped": false,
    "wormed": true,
    "kc_registered": false,
    "original_breeder": false,
    "viewable_with_mother": false
  },
  {
    "url": "https://gundogsdirect.co.uk/dogs-for-sale/labradors-for-sale/labradors-at-stud/28822",
    "id": "28822",
    "platform": "gundogs_direct",
    "scraped_at": "2026-01-24T20:35:42.022115",
    "title": "\ud83d\udc36 Buyer\u2019s Checklist for Gun Dogs",
    "breed": "Labradors",
    "price": "400",
    "posted_date": "21-04-2025",
    "posted_date_iso": "2025-04-21",
    "last_updated": "24-01-2026",
    "date_of_birth": "20 Feb 2023",
    "location": "Hampshire",
    "seller_name": "Simon Dunn",
    "member_since": "21st April 2025",
    "verified_breeder": false,
    "health_checked": true,
    "hip_scored": false,
    "elbow_scored": false,
    "eye_tested": false,
    "vaccinated": false,
    "microchipped": false,
    "wormed": true,
    "kc_registered": false,
    "original_breeder": false,
    "viewable_with_mother": false
  },
  {
    "url": "https://gundogsdirect.co.uk/dogs-for-sale/springer-spaniels-for-sale/springer-spaniel-puppies/31083",
    "id": "31083",
    "platform": "gundogs_direct",
    "scraped_at": "2026-01-24T20:35:44.469939",
    "title": "\ud83d\udc36 Buyer\u2019s Checklist for Gun Dogs",
    "breed": "Springer Spaniels",
    "price": "800",
    "posted_date": "12-01-2026",
    "posted_date_iso": "2026-01-12",
    "last_updated": "24-01-2026",
    "location": "Cardiff",
    "seller_name": "Nadeem Butt",
    "member_since": "12th January 2026",
    "verified_breeder": false,
    "health_checked": false,
    "hip_scored": false,
    "elbow_scored": false,
    "eye_tested": false,
    "vaccinated": false,
    "microchipped": false,
    "wormed": true,
    "kc_registered": false,
    "original_breeder": true,
    "viewable_with_mother": true
  },
  {
    "url": "https://gundogsdirect.co.uk/dogs-for-sale/springer-spaniels-for-sale/part-traind-springer-spaniels/31081",
    "id": "31081",
    "platform": "gundogs_direct",
    "scraped_at": "2026-01-24T20:35:46.972856",
    "title": "\ud83d\udc36 Buyer\u2019s Checklist for Gun Dogs",
    "breed": "Springer Spaniels",
    "price": "2500",
    "posted_date": "12-01-2026",
    "posted_date_iso": "2026-01-12",
    "last_updated": "24-01-2026",
    "location": "Northern Ireland",
    "seller_name": "Jimmy Jimmy",
    "member_since": "12th January 2026",
    "verified_breeder": false,
    "health_checked": true,
    "hip_scored": false,
    "elbow_scored": false,
    "eye_tested": false,
    "vaccinated": false,
    "microchipped": false,
    "wormed": true,
    "kc_registered": false,
    "original_breeder": false,
    "viewable_with_mother": false
  },
  {
    "url": "https://gundogsdirect.co.uk/dogs-for-sale/teckel/teckel-stud/31080",
    "id": "31080",
    "platform": "gundogs_direct",
    "scraped_at": "2026-01-24T20:35:49.556268",
    "title": "\ud83d\udc36 Buyer\u2019s Checklist for Gun Dogs",
    "price": "500",
    "posted_date": "12-01-2026",
    "posted_date_iso": "2026-01-12",
    "last_updated": "24-01-2026",
    "date_of_birth": "12 Apr 2024",
    "location": "Ripon",
    "seller_name": "Emily D",
    "member_since": "30th April 2024",
    "verified_breeder": false,
    "health_checked": true,
    "hip_scored": false,
    "elbow_scored": false,
    "eye_tested": false,
    "vaccinated": false,
    "microchipped": false,
    "wormed": true,
    "kc_registered": false,
    "original_breeder": false,
    "viewable_with_mother": false
  },
  {
    "url": "https://gundogsdirect.co.uk/dogs-for-sale/gwp/gwp-puppies/31066",
    "id": "31066",
    "platform": "gundogs_direct",
    "scraped_at": "2026-01-24T20:35:52.026632",
    "title": "\ud83d\udc36 Buyer\u2019s Checklist for Gun Dogs",
    "price": "1500",
    "posted_date": "09-01-2026",
    "posted_date_iso": "2026-01-09",
    "last_updated": "24-01-2026",
    "date_of_birth": "9 Nov 2025",
    "location": "Horncastle",
    "seller_name": "Rory major",
    "member_since": "8th May 2024",
    "verified_breeder": false,
    "health_checked": true,
    "hip_scored": false,
    "elbow_scored": false,
    "eye_tested": false,
    "vaccinated": false,
    "microchipped": false,
    "wormed": true,
    "kc_registered": false,
    "original_breeder": true,
    "viewable_with_mother": true
  },
  {
    "url": "https://gundogsdirect.co.uk/dogs-for-sale/labradors-for-sale/labrador-puppies-for-sale/30908",
    "id": "30908",
    "platform": "gundogs_direct",
    "scraped_at": "2026-01-24T20:35:54.482216",
    "title": "\ud83d\udc36 Buyer\u2019s Checklist for Gun Dogs",
    "breed": "Labradors",
    "price": "1500",
    "posted_date": "10-12-2025",
    "posted_date_iso": "2025-12-10",
    "last_updated": "24-01-2026",
    "date_of_birth": "10 Jun 2025",
    "location": "Banchory",
    "seller_name": "Iona Blackhall",
    "member_since": "30th April 2024",
    "verified_breeder": false,
    "health_checked": true,
    "hip_scored": false,
    "elbow_scored": false,
    "eye_tested": false,
    "vaccinated": false,
    "microchipped": false,
    "wormed": true,
    "kc_registered": false,
    "original_breeder": true,
    "viewable_with_mother": true
  },
  {
    "url": "https://gundogsdirect.co.uk/dogs-for-sale/labradors-for-sale/labrador-puppies-for-sale/30863",
    "id": "30863",
    "platform": "gundogs_direct",
    "scraped_at": "2026-01-24T20:35:56.963720",
    "title": "\ud83d\udc36 Buyer\u2019s Checklist for Gun Dogs",
    "breed": "Labradors",
    "price": "1500",
    "posted_date": "05-12-2025",
    "posted_date_iso": "2025-12-05",
    "last_updated": "24-01-2026",
    "date_of_birth": "14 Nov 2025",
    "location": "Middlewich",
    "seller_name": "Bernadette Jenkins",
    "member_since": "31st May 2025",
    "verified_breeder": false,
    "health_checked": false,
    "hip_scored": false,
    "elbow_scored": false,
    "eye_tested": false,
    "vaccinated": false,
    "microchipped": false,
    "wormed": true,
    "kc_registered": false,
    "original_breeder": true,
    "viewable_with_mother": true
  },
  {
    "url": "https://gundogsdirect.co.uk/dogs-for-sale/labradors-for-sale/labradors-at-stud/31140",
    "id": "31140",
    "platform": "gundogs_direct",
    "scraped_at": "2026-01-24T20:35:59.454718",
    "title": "\ud83d\udc36 Buyer\u2019s Checklist for Gun Dogs",
    "breed": "Labradors",
    "price": "600",
    "posted_date": "24-01-2026",
    "posted_date_iso": "2026-01-24",
    "last_updated": "24-01-2026",
    "location": "Bristol",
    "seller_name": "Michelle Cox",
    "member_since": "30th April 2024",
    "verified_breeder": false,
    "health_checked": true,
    "hip_scored": false,
    "elbow_scored": false,
    "eye_tested": false,
    "vaccinated": false,
    "microchipped": false,
    "wormed": true,
    "kc_registered": false,
    "original_breeder": true,
    "viewable_with_mother": false
  },
  {
    "url": "https://gundogsdirect.co.uk/dogs-for-sale/labradors-for-sale/trained-labradors/31139",
    "id": "31139",
    "platform": "gundogs_direct",
    "scraped_at": "2026-01-24T20:36:01.892427",
    "title": "\ud83d\udc36 Buyer\u2019s Checklist for Gun Dogs",
    "breed": "Labradors",
    "price": "1000",
    "posted_date": "24-01-2026",
    "posted_date_iso": "2026-01-24",
    "last_updated": "24-01-2026",
    "date_of_birth": "11 Feb 2022",
    "location": "Warminster",
    "seller_name": "Kimberley Candy",
    "member_since": "6th September 2025",
    "verified_breeder": false,
    "health_checked": true,
    "hip_scored": false,
    "elbow_scored": false,
    "eye_tested": false,
    "vaccinated": false,
    "microchipped": false,
    "wormed": true,
    "kc_registered": false,
    "original_breeder": true,
    "viewable_with_mother": false
  },
  {
    "url": "https://gundogsdirect.co.uk/dogs-for-sale/springer-spaniels-for-sale/part-traind-springer-spaniels/31136",
    "id": "31136",
    "platform": "gundogs_direct",
    "scraped_at": "2026-01-24T20:36:04.290782",
    "title": "\ud83d\udc36 Buyer\u2019s Checklist for Gun Dogs",
    "breed": "Springer Spaniels",
    "price": "1800",
    "posted_date": "23-01-2026",
    "posted_date_iso": "2026-01-23",
    "last_updated": "24-01-2026",
    "location": "Kirkcaldy",
    "seller_name": "Richard McQueen",
    "member_since": "13th May 2024",
    "verified_breeder": false,
    "health_checked": false,
    "hip_scored": false,
    "elbow_scored": false,
    "eye_tested": false,
    "vaccinated": false,
    "microchipped": false,
    "wormed": true,
    "kc_registered": false,
    "original_breeder": false,
    "viewable_with_mother": false
  },
  {
    "url": "https://gundogsdirect.co.uk/dogs-for-sale/cocker-spaniels-for-sale/cocker-spaniel-at-stud/31135",
    "id": "31135",
    "platform": "gundogs_direct",
    "scraped_at": "2026-01-24T20:36:06.643239",
    "title": "\ud83d\udc36 Buyer\u2019s Checklist for Gun Dogs",
    "breed": "Cocker Spaniels",
    "price": "150",
    "posted_date": "23-01-2026",
    "posted_date_iso": "2026-01-23",
    "last_updated": "24-01-2026",
    "date_of_birth": "4 Jul 2024",
    "location": "Taunton",
    "seller_name": "Billie Harding",
    "member_since": "3rd June 2024",
    "verified_breeder": false,
    "health_checked": true,
    "hip_scored": false,
    "elbow_scored": false,
    "eye_tested": false,
    "vaccinated": false,
    "microchipped": false,
    "wormed": true,
    "kc_registered": false,
    "original_breeder": false,
    "viewable_with_mother": false
  },
  {
    "url": "https://gundogsdirect.co.uk/dogs-for-sale/cocker-spaniels-for-sale/part-trained-cocker-spaniels/31133",
    "id": "31133",
    "platform": "gundogs_direct",
    "scraped_at": "2026-01-24T20:36:09.151342",
    "title": "\ud83d\udc36 Buyer\u2019s Checklist for Gun Dogs",
    "breed": "Cocker Spaniels",
    "price": "1850",
    "posted_date": "22-01-2026",
    "posted_date_iso": "2026-01-22",
    "last_updated": "24-01-2026",
    "location": "Trent",
    "seller_name": "W Smith",
    "member_since": "17th October 2025",
    "verified_breeder": false,
    "health_checked": false,
    "hip_scored": false,
    "elbow_scored": false,
    "eye_tested": false,
    "vaccinated": false,
    "microchipped": false,
    "wormed": true,
    "kc_registered": false,
    "original_breeder": false,
    "viewable_with_mother": false
  },
  {
    "url": "https://gundogsdirect.co.uk/dogs-for-sale/cocker-spaniels-for-sale/part-trained-cocker-spaniels/31132",
    "id": "31132",
    "platform": "gundogs_direct",
    "scraped_at": "2026-01-24T20:36:11.581183",
    "title": "\ud83d\udc36 Buyer\u2019s Checklist for Gun Dogs",
    "breed": "Cocker Spaniels",
    "price": "1500",
    "posted_date": "22-01-2026",
    "posted_date_iso": "2026-01-22",
    "last_updated": "24-01-2026",
    "location": "Callington",
    "seller_name": "Jason fear",
    "member_since": "22nd May 2024",
    "verified_breeder": false,
    "health_checked": false,
    "hip_scored": false,
    "elbow_scored": false,
    "eye_tested": false,
    "vaccinated": false,
    "microchipped": false,
    "wormed": true,
    "kc_registered": false,
    "original_breeder": false,
    "viewable_with_mother": false
  },
  {
    "url": "https://gundogsdirect.co.uk/dogs-for-sale/labradors-for-sale/part-trained-labradors/31130",
    "id": "31130",
    "platform": "gundogs_direct",
    "scraped_at": "2026-01-24T20:36:14.055277",
    "title": "\ud83d\udc36 Buyer\u2019s Checklist for Gun Dogs",
    "breed": "Labradors",
    "price": "1000",
    "posted_date": "22-01-2026",
    "posted_date_iso": "2026-01-22",
    "last_updated": "24-01-2026",
    "location": "Bristol",
    "seller_name": "Michelle Cox",
    "member_since": "30th April 2024",
    "verified_breeder": false,
    "health_checked": false,
    "hip_scored": false,
    "elbow_scored": false,
    "eye_tested": false,
    "vaccinated": false,
    "microchipped": false,
    "wormed": true,
    "kc_registered": false,
    "original_breeder": true,
    "viewable_with_mother": true
  },
  {
    "url": "https://gundogsdirect.co.uk/dogs-for-sale/cocker-spaniels-for-sale/cocker-spaniel-puppies/31129",
    "id": "31129",
    "platform": "gundogs_direct",
    "scraped_at": "2026-01-24T20:36:16.433529",
    "title": "\ud83d\udc36 Buyer\u2019s Checklist for Gun Dogs",
    "breed": "Cocker Spaniels",
    "price": "1200",
    "posted_date": "21-01-2026",
    "posted_date_iso": "2026-01-21",
    "last_updated": "24-01-2026",
    "date_of_birth": "25 Dec 2025",
    "location": "Mansfield",
    "seller_name": "Jamie Archer",
    "member_since": "21st January 2026",
    "verified_breeder": false,
    "health_checked": false,
    "hip_scored": false,
    "elbow_scored": false,
    "eye_tested": false,
    "vaccinated": false,
    "microchipped": false,
    "wormed": true,
    "kc_registered": false,
    "original_breeder": true,
    "viewable_with_mother": true
  },
  {
    "url": "https://gundogsdirect.co.uk/dogs-for-sale/labradors-for-sale/labrador-puppies-for-sale/31128",
    "id": "31128",
    "platform": "gundogs_direct",
    "scraped_at": "2026-01-24T20:36:19.019313",
    "title": "\ud83d\udc36 Buyer\u2019s Checklist for Gun Dogs",
    "breed": "Labradors",
    "price": "1750",
    "posted_date": "21-01-2026",
    "posted_date_iso": "2026-01-21",
    "last_updated": "24-01-2026",
    "date_of_birth": "14 Jan 2026",
    "age": "1",
    "location": "Sandbach",
    "seller_name": "Sarah Roberts",
    "member_since": "26th July 2024",
    "verified_breeder": false,
    "health_checked": false,
    "hip_scored": false,
    "elbow_scored": false,
    "eye_tested": false,
    "vaccinated": false,
    "microchipped": false,
    "wormed": true,
    "kc_registered": false,
    "original_breeder": true,
    "viewable_with_mother": true
  },
  {
    "url": "https://gundogsdirect.co.uk/dogs-for-sale/labradors-for-sale/part-trained-labradors/31126",
    "id": "31126",
    "platform": "gundogs_direct",
    "scraped_at": "2026-01-24T20:36:21.432642",
    "title": "\ud83d\udc36 Buyer\u2019s Checklist for Gun Dogs",
    "breed": "Labradors",
    "price": "1600",
    "posted_date": "21-01-2026",
    "posted_date_iso": "2026-01-21",
    "last_updated": "24-01-2026",
    "date_of_birth": "30 May 2025",
    "location": "Linlithgow",
    "seller_name": "Perry Parkinson",
    "member_since": "10th April 2025",
    "verified_breeder": false,
    "health_checked": true,
    "hip_scored": false,
    "elbow_scored": false,
    "eye_tested": false,
    "vaccinated": false,
    "microchipped": false,
    "wormed": true,
    "kc_registered": false,
    "original_breeder": true,
    "viewable_with_mother": true
  },
  {
    "url": "https://gundogsdirect.co.uk/dogs-for-sale/cocker-spaniels-for-sale/cocker-spaniel-at-stud/31124",
    "id": "31124",
    "platform": "gundogs_direct",
    "scraped_at": "2026-01-24T20:36:23.881389",
    "title": "\ud83d\udc36 Buyer\u2019s Checklist for Gun Dogs",
    "breed": "Cocker Spaniels",
    "price": "300",
    "posted_date": "20-01-2026",
    "posted_date_iso": "2026-01-20",
    "last_updated": "24-01-2026",
    "date_of_birth": "23 Apr 2023",
    "location": "South Yorkshire",
    "seller_name": "Edwin Lodge",
    "member_since": "31st December 2024",
    "verified_breeder": false,
    "health_checked": true,
    "hip_scored": false,
    "elbow_scored": false,
    "eye_tested": false,
    "vaccinated": false,
    "microchipped": false,
    "wormed": true,
    "kc_registered": false,
    "original_breeder": true,
    "viewable_with_mother": false
  },
  {
    "url": "https://gundogsdirect.co.uk/dogs-for-sale/cocker-spaniels-for-sale/cocker-spaniel-puppies/31121",
    "id": "31121",
    "platform": "gundogs_direct",
    "scraped_at": "2026-01-24T20:36:26.346702",
    "title": "\ud83d\udc36 Buyer\u2019s Checklist for Gun Dogs",
    "breed": "Cocker Spaniels",
    "price": "1250",
    "posted_date": "20-01-2026",
    "posted_date_iso": "2026-01-20",
    "last_updated": "24-01-2026",
    "date_of_birth": "9 Dec 2025",
    "location": "Clevedon",
    "seller_name": "Gabby Rowe",
    "member_since": "20th January 2026",
    "verified_breeder": false,
    "health_checked": false,
    "hip_scored": false,
    "elbow_scored": false,
    "eye_tested": false,
    "vaccinated": false,
    "microchipped": false,
    "wormed": true,
    "kc_registered": false,
    "original_breeder": true,
    "viewable_with_mother": true
  },
  {
    "url": "https://gundogsdirect.co.uk/dogs-for-sale/springer-spaniels-for-sale/springer-spaniels-at-stud/31118",
    "id": "31118",
    "platform": "gundogs_direct",
    "scraped_at": "2026-01-24T20:36:28.848273",
    "title": "\ud83d\udc36 Buyer\u2019s Checklist for Gun Dogs",
    "breed": "Springer Spaniels",
    "price": "200",
    "posted_date": "20-01-2026",
    "posted_date_iso": "2026-01-20",
    "last_updated": "24-01-2026",
    "date_of_birth": "14 Aug 2020",
    "location": "Bewdley",
    "seller_name": "natasha baker",
    "member_since": "20th January 2026",
    "verified_breeder": false,
    "health_checked": false,
    "hip_scored": false,
    "elbow_scored": false,
    "eye_tested": false,
    "vaccinated": false,
    "microchipped": false,
    "wormed": true,
    "kc_registered": false,
    "original_breeder": false,
    "viewable_with_mother": false
  },
  {
    "url": "https://gundogsdirect.co.uk/dogs-for-sale/cocker-spaniels-for-sale/cocker-spaniel-puppies/31116",
    "id": "31116",
    "platform": "gundogs_direct",
    "scraped_at": "2026-01-24T20:36:31.322416",
    "title": "\ud83d\udc36 Buyer\u2019s Checklist for Gun Dogs",
    "breed": "Cocker Spaniels",
    "price": "1600",
    "posted_date": "19-01-2026",
    "posted_date_iso": "2026-01-19",
    "last_updated": "24-01-2026",
    "date_of_birth": "10 Jan 2026",
    "ready_to_leave": "8th March",
    "location": "Horsham",
    "seller_name": "Rebecca Bainbridge",
    "member_since": "19th January 2026",
    "verified_breeder": false,
    "health_checked": true,
    "hip_scored": false,
    "elbow_scored": false,
    "eye_tested": false,
    "vaccinated": false,
    "microchipped": false,
    "wormed": true,
    "kc_registered": false,
    "original_breeder": true,
    "viewable_with_mother": true
  },
  {
    "url": "https://gundogsdirect.co.uk/dogs-for-sale/cocker-spaniels-for-sale/trained-cocker-spaniels/31115",
    "id": "31115",
    "platform": "gundogs_direct",
    "scraped_at": "2026-01-24T20:36:33.804720",
    "title": "\ud83d\udc36 Buyer\u2019s Checklist for Gun Dogs",
    "breed": "Cocker Spaniels",
    "price": "3000",
    "posted_date": "19-01-2026",
    "posted_date_iso": "2026-01-19",
    "last_updated": "24-01-2026",
    "date_of_birth": "19 Jan 2024",
    "location": "Ringwood",
    "seller_name": "Olive Burton",
    "member_since": "13th September 2024",
    "verified_breeder": false,
    "health_checked": true,
    "hip_scored": false,
    "elbow_scored": false,
    "eye_tested": false,
    "vaccinated": false,
    "microchipped": false,
    "wormed": false,
    "kc_registered": false,
    "original_breeder": false,
    "viewable_with_mother": false
  },
  {
    "url": "https://gundogsdirect.co.uk/dogs-for-sale/labradors-for-sale/labradors-at-stud/31114",
    "id": "31114",
    "platform": "gundogs_direct",
    "scraped_at": "2026-01-24T20:36:36.213357",
    "title": "\ud83d\udc36 Buyer\u2019s Checklist for Gun Dogs",
    "breed": "Labradors",
    "price": "400",
    "posted_date": "19-01-2026",
    "posted_date_iso": "2026-01-19",
    "last_updated": "24-01-2026",
    "location": "Devizes",
    "seller_name": "Luke Cairns",
    "member_since": "30th April 2024",
    "verified_breeder": false,
    "health_checked": true,
    "hip_scored": false,
    "elbow_scored": false,
    "eye_tested": false,
    "vaccinated": false,
    "microchipped": false,
    "wormed": true,
    "kc_registered": false,
    "original_breeder": false,
    "viewable_with_mother": false
  },
  {
    "url": "https://gundogsdirect.co.uk/dogs-for-sale/cocker-spaniels-for-sale/cocker-spaniel-puppies/31112",
    "id": "31112",
    "platform": "gundogs_direct",
    "scraped_at": "2026-01-24T20:36:38.662161",
    "title": "\ud83d\udc36 Buyer\u2019s Checklist for Gun Dogs",
    "breed": "Cocker Spaniels",
    "price": "1250",
    "posted_date": "19-01-2026",
    "posted_date_iso": "2026-01-19",
    "last_updated": "24-01-2026",
    "date_of_birth": "9 Jan 2026",
    "location": "Reading",
    "seller_name": "Jo White",
    "member_since": "19th January 2026",
    "verified_breeder": false,
    "health_checked": true,
    "hip_scored": false,
    "elbow_scored": false,
    "eye_tested": false,
    "vaccinated": false,
    "microchipped": false,
    "wormed": true,
    "kc_registered": false,
    "original_breeder": true,
    "viewable_with_mother": true
  },
  {
    "url": "https://gundogsdirect.co.uk/dogs-for-sale/springer-spaniels-for-sale/springer-spaniels-at-stud/31111",
    "id": "31111",
    "platform": "gundogs_direct",
    "scraped_at": "2026-01-24T20:36:41.135004",
    "title": "\ud83d\udc36 Buyer\u2019s Checklist for Gun Dogs",
    "breed": "Springer Spaniels",
    "price": "300",
    "posted_date": "18-01-2026",
    "posted_date_iso": "2026-01-18",
    "last_updated": "24-01-2026",
    "date_of_birth": "11 May 2020",
    "location": "Worcester",
    "seller_name": "Sam Smith",
    "member_since": "7th April 2025",
    "verified_breeder": false,
    "health_checked": true,
    "hip_scored": false,
    "elbow_scored": false,
    "eye_tested": false,
    "vaccinated": false,
    "microchipped": false,
    "wormed": true,
    "kc_registered": false,
    "original_breeder": false,
    "viewable_with_mother": false
  },
  {
    "url": "https://gundogsdirect.co.uk/dogs-for-sale/cocker-spaniels-for-sale/part-trained-cocker-spaniels/31109",
    "id": "31109",
    "platform": "gundogs_direct",
    "scraped_at": "2026-01-24T20:36:43.659201",
    "title": "\ud83d\udc36 Buyer\u2019s Checklist for Gun Dogs",
    "breed": "Cocker Spaniels",
    "price": "2500",
    "posted_date": "18-01-2026",
    "posted_date_iso": "2026-01-18",
    "last_updated": "24-01-2026",
    "date_of_birth": "22 Jun 2025",
    "location": "Ludlow",
    "seller_name": "Matthew Brown",
    "member_since": "20th October 2024",
    "verified_breeder": false,
    "health_checked": false,
    "hip_scored": false,
    "elbow_scored": false,
    "eye_tested": false,
    "vaccinated": false,
    "microchipped": false,
    "wormed": true,
    "kc_registered": false,
    "original_breeder": true,
    "viewable_with_mother": true
  },
  {
    "url": "https://gundogsdirect.co.uk/dogs-for-sale/gwp/gwp-puppies/31106",
    "id": "31106",
    "platform": "gundogs_direct",
    "scraped_at": "2026-01-24T20:36:46.209856",
    "title": "\ud83d\udc36 Buyer\u2019s Checklist for Gun Dogs",
    "price": "850",
    "posted_date": "17-01-2026",
    "posted_date_iso": "2026-01-17",
    "last_updated": "24-01-2026",
    "available_puppies": 8,
    "date_of_birth": "28 Nov 2025",
    "ready_to_leave": "8 weeks",
    "age": "8",
    "location": "Oswestry",
    "seller_name": "Garry Jones",
    "member_since": "17th January 2026",
    "verified_breeder": false,
    "health_checked": false,
    "hip_scored": false,
    "elbow_scored": false,
    "eye_tested": false,
    "vaccinated": false,
    "microchipped": false,
    "wormed": true,
    "kc_registered": false,
    "original_breeder": true,
    "viewable_with_mother": true
  },
  {
    "url": "https://gundogsdirect.co.uk/dogs-for-sale/cocker-spaniels-for-sale/part-trained-cocker-spaniels/31104",
    "id": "31104",
    "platform": "gundogs_direct",
    "scraped_at": "2026-01-24T20:36:48.670225",
    "title": "\ud83d\udc36 Buyer\u2019s Checklist for Gun Dogs",
    "breed": "Cocker Spaniels",
    "price": "1800",
    "posted_date": "17-01-2026",
    "posted_date_iso": "2026-01-17",
    "last_updated": "24-01-2026",
    "date_of_birth": "17 Feb 2025",
    "location": "Princes Risborough",
    "seller_name": "Nicole Clements",
    "member_since": "30th April 2024",
    "verified_breeder": false,
    "health_checked": false,
    "hip_scored": false,
    "elbow_scored": false,
    "eye_tested": false,
    "vaccinated": false,
    "microchipped": false,
    "wormed": true,
    "kc_registered": false,
    "original_breeder": false,
    "viewable_with_mother": false
  },
  {
    "url": "https://gundogsdirect.co.uk/dogs-for-sale/springer-spaniels-for-sale/springer-spaniel-puppies/31103",
    "id": "31103",
    "platform": "gundogs_direct",
    "scraped_at": "2026-01-24T20:36:51.124084",
    "title": "\ud83d\udc36 Buyer\u2019s Checklist for Gun Dogs",
    "breed": "Springer Spaniels",
    "price": "1400",
    "posted_date": "16-01-2026",
    "posted_date_iso": "2026-01-16",
    "last_updated": "24-01-2026",
    "date_of_birth": "11 Jan 2026",
    "ready_to_leave": "8th March 2026",
    "age": "4",
    "location": "Herefordshire",
    "seller_name": "Gareth Taylor",
    "member_since": "14th January 2025",
    "verified_breeder": false,
    "health_checked": false,
    "hip_scored": false,
    "elbow_scored": false,
    "eye_tested": false,
    "vaccinated": false,
    "microchipped": false,
    "wormed": true,
    "kc_registered": false,
    "original_breeder": true,
    "viewable_with_mother": true
  },
  {
    "url": "https://gundogsdirect.co.uk/dogs-for-sale/springer-spaniels-for-sale/springer-spaniels-at-stud/31102",
    "id": "31102",
    "platform": "gundogs_direct",
    "scraped_at": "2026-01-24T20:36:53.692115",
    "title": "\ud83d\udc36 Buyer\u2019s Checklist for Gun Dogs",
    "breed": "Springer Spaniels",
    "price": "250",
    "posted_date": "16-01-2026",
    "posted_date_iso": "2026-01-16",
    "last_updated": "24-01-2026",
    "date_of_birth": "1 Aug 2023",
    "location": "Romsey",
    "seller_name": "Lucy Holder",
    "member_since": "14th September 2024",
    "verified_breeder": false,
    "health_checked": true,
    "hip_scored": false,
    "elbow_scored": false,
    "eye_tested": false,
    "vaccinated": false,
    "microchipped": false,
    "wormed": true,
    "kc_registered": false,
    "original_breeder": true,
    "viewable_with_mother": false
  },
  {
    "url": "https://gundogsdirect.co.uk/dogs-for-sale/hungarian-visla/hungarian-visla-puppies/31101",
    "id": "31101",
    "platform": "gundogs_direct",
    "scraped_at": "2026-01-24T20:36:56.238399",
    "title": "\ud83d\udc36 Buyer\u2019s Checklist for Gun Dogs",
    "price": "1500",
    "posted_date": "16-01-2026",
    "posted_date_iso": "2026-01-16",
    "last_updated": "24-01-2026",
    "date_of_birth": "20 Dec 2025",
    "location": "Pershore",
    "seller_name": "Helen Phillips",
    "member_since": "16th January 2026",
    "verified_breeder": false,
    "health_checked": false,
    "hip_scored": false,
    "elbow_scored": false,
    "eye_tested": false,
    "vaccinated": false,
    "microchipped": false,
    "wormed": true,
    "kc_registered": false,
    "original_breeder": true,
    "viewable_with_mother": true
  },
  {
    "url": "https://gundogsdirect.co.uk/dogs-for-sale/springer-spaniels-for-sale/springer-spaniels-at-stud/31098",
    "id": "31098",
    "platform": "gundogs_direct",
    "scraped_at": "2026-01-24T20:36:58.713922",
    "title": "\ud83d\udc36 Buyer\u2019s Checklist for Gun Dogs",
    "breed": "Springer Spaniels",
    "price": "400",
    "posted_date": "15-01-2026",
    "posted_date_iso": "2026-01-15",
    "last_updated": "24-01-2026",
    "location": "Clevedon",
    "seller_name": "Liam Morris",
    "member_since": "16th January 2025",
    "verified_breeder": false,
    "health_checked": true,
    "hip_scored": false,
    "elbow_scored": false,
    "eye_tested": false,
    "vaccinated": false,
    "microchipped": false,
    "wormed": true,
    "kc_registered": false,
    "original_breeder": false,
    "viewable_with_mother": false
  },
  {
    "url": "https://gundogsdirect.co.uk/dogs-for-sale/cocker-spaniels-for-sale/cocker-spaniel-at-stud/31095",
    "id": "31095",
    "platform": "gundogs_direct",
    "scraped_at": "2026-01-24T20:37:01.126927",
    "title": "\ud83d\udc36 Buyer\u2019s Checklist for Gun Dogs",
    "breed": "Cocker Spaniels",
    "price": "300",
    "posted_date": "15-01-2026",
    "posted_date_iso": "2026-01-15",
    "last_updated": "24-01-2026",
    "date_of_birth": "24 Apr 2023",
    "location": "Spennymoor",
    "seller_name": "Gregg Potts",
    "member_since": "5th July 2024",
    "verified_breeder": false,
    "health_checked": true,
    "hip_scored": false,
    "elbow_scored": false,
    "eye_tested": false,
    "vaccinated": false,
    "microchipped": false,
    "wormed": true,
    "kc_registered": false,
    "original_breeder": false,
    "viewable_with_mother": false
  },
  {
    "url": "https://gundogsdirect.co.uk/dogs-for-sale/cocker-spaniels-for-sale/cocker-spaniel-at-stud/31091",
    "id": "31091",
    "platform": "gundogs_direct",
    "scraped_at": "2026-01-24T20:37:03.609004",
    "title": "\ud83d\udc36 Buyer\u2019s Checklist for Gun Dogs",
    "breed": "Cocker Spaniels",
    "price": "400",
    "posted_date": "13-01-2026",
    "posted_date_iso": "2026-01-13",
    "last_updated": "24-01-2026",
    "location": "Winchester",
    "seller_name": "Kayleigh Snell",
    "member_since": "5th May 2024",
    "verified_breeder": false,
    "health_checked": true,
    "hip_scored": false,
    "elbow_scored": false,
    "eye_tested": false,
    "vaccinated": false,
    "microchipped": false,
    "wormed": true,
    "kc_registered": false,
    "original_breeder": true,
    "viewable_with_mother": false
  },
  {
    "url": "https://gundogsdirect.co.uk/dogs-for-sale/springer-spaniels-for-sale/trained-springer-spaniels/31090",
    "id": "31090",
    "platform": "gundogs_direct",
    "scraped_at": "2026-01-24T20:37:06.034532",
    "title": "\ud83d\udc36 Buyer\u2019s Checklist for Gun Dogs",
    "breed": "Springer Spaniels",
    "price": "3500",
    "posted_date": "13-01-2026",
    "posted_date_iso": "2026-01-13",
    "last_updated": "24-01-2026",
    "date_of_birth": "4 Apr 2021",
    "location": "Bridgend",
    "seller_name": "Lewis Williams",
    "member_since": "30th April 2024",
    "verified_breeder": false,
    "health_checked": false,
    "hip_scored": false,
    "elbow_scored": false,
    "eye_tested": false,
    "vaccinated": false,
    "microchipped": false,
    "wormed": true,
    "kc_registered": false,
    "original_breeder": false,
    "viewable_with_mother": false
  },
  {
    "url": "https://gundogsdirect.co.uk/dogs-for-sale/springer-spaniels-for-sale/springer-spaniels-at-stud/31087",
    "id": "31087",
    "platform": "gundogs_direct",
    "scraped_at": "2026-01-24T20:37:08.497583",
    "title": "\ud83d\udc36 Buyer\u2019s Checklist for Gun Dogs",
    "breed": "Springer Spaniels",
    "price": "500",
    "posted_date": "13-01-2026",
    "posted_date_iso": "2026-01-13",
    "last_updated": "24-01-2026",
    "location": "Somerset",
    "seller_name": "Simon Jones",
    "member_since": "30th April 2024",
    "verified_breeder": false,
    "health_checked": true,
    "hip_scored": false,
    "elbow_scored": false,
    "eye_tested": false,
    "vaccinated": false,
    "microchipped": false,
    "wormed": true,
    "kc_registered": false,
    "original_breeder": true,
    "viewable_with_mother": false
  },
  {
    "url": "https://gundogsdirect.co.uk/dogs-for-sale/cocker-spaniels-for-sale/part-trained-cocker-spaniels/31075",
    "id": "31075",
    "platform": "gundogs_direct",
    "scraped_at": "2026-01-24T20:37:11.007216",
    "title": "\ud83d\udc36 Buyer\u2019s Checklist for Gun Dogs",
    "breed": "Cocker Spaniels",
    "price": "3500",
    "posted_date": "11-01-2026",
    "posted_date_iso": "2026-01-11",
    "last_updated": "24-01-2026",
    "date_of_birth": "2 Jul 2024",
    "location": "Pontypool",
    "seller_name": "Steffan Jones",
    "member_since": "12th July 2024",
    "verified_breeder": false,
    "health_checked": true,
    "hip_scored": false,
    "elbow_scored": false,
    "eye_tested": false,
    "vaccinated": false,
    "microchipped": false,
    "wormed": true,
    "kc_registered": false,
    "original_breeder": false,
    "viewable_with_mother": false
  },
  {
    "url": "https://gundogsdirect.co.uk/dogs-for-sale/cocker-spaniels-for-sale/cocker-spaniel-puppies/31073",
    "id": "31073",
    "platform": "gundogs_direct",
    "scraped_at": "2026-01-24T20:37:13.441038",
    "title": "\ud83d\udc36 Buyer\u2019s Checklist for Gun Dogs",
    "breed": "Cocker Spaniels",
    "price": "1000",
    "posted_date": "11-01-2026",
    "posted_date_iso": "2026-01-11",
    "last_updated": "24-01-2026",
    "date_of_birth": "30 Nov 2025",
    "location": "Higham Ferrers",
    "seller_name": "carol smith",
    "member_since": "11th January 2026",
    "verified_breeder": false,
    "health_checked": true,
    "hip_scored": false,
    "elbow_scored": false,
    "eye_tested": false,
    "vaccinated": false,
    "microchipped": false,
    "wormed": true,
    "kc_registered": false,
    "original_breeder": true,
    "viewable_with_mother": true
  },
  {
    "url": "https://gundogsdirect.co.uk/dogs-for-sale/labradors-for-sale/labrador-puppies-for-sale/31072",
    "id": "31072",
    "platform": "gundogs_direct",
    "scraped_at": "2026-01-24T20:37:15.858663",
    "title": "\ud83d\udc36 Buyer\u2019s Checklist for Gun Dogs",
    "breed": "Labradors",
    "price": "600",
    "posted_date": "10-01-2026",
    "posted_date_iso": "2026-01-10",
    "last_updated": "24-01-2026",
    "date_of_birth": "21 Nov 2025",
    "location": "Dromore",
    "seller_name": "Belinda Hawthorne",
    "member_since": "5th January 2026",
    "verified_breeder": false,
    "health_checked": true,
    "hip_scored": false,
    "elbow_scored": false,
    "eye_tested": false,
    "vaccinated": false,
    "microchipped": false,
    "wormed": true,
    "kc_registered": false,
    "original_breeder": true,
    "viewable_with_mother": true
  },
  {
    "url": "https://gundogsdirect.co.uk/dogs-for-sale/labradors-for-sale/part-trained-labradors/31070",
    "id": "31070",
    "platform": "gundogs_direct",
    "scraped_at": "2026-01-24T20:37:18.367365",
    "title": "\ud83d\udc36 Buyer\u2019s Checklist for Gun Dogs",
    "breed": "Labradors",
    "price": "3000",
    "posted_date": "10-01-2026",
    "posted_date_iso": "2026-01-10",
    "last_updated": "24-01-2026",
    "date_of_birth": "18 May 2025",
    "location": "Grimsby",
    "seller_name": "Tom Hamilton",
    "member_since": "31st May 2024",
    "verified_breeder": false,
    "health_checked": false,
    "hip_scored": false,
    "elbow_scored": false,
    "eye_tested": false,
    "vaccinated": false,
    "microchipped": false,
    "wormed": true,
    "kc_registered": false,
    "original_breeder": true,
    "viewable_with_mother": true
  },
  {
    "url": "https://gundogsdirect.co.uk/dogs-for-sale/cocker-spaniels-for-sale/cocker-spaniel-puppies/31069",
    "id": "31069",
    "platform": "gundogs_direct",
    "scraped_at": "2026-01-24T20:37:20.791781",
    "title": "\ud83d\udc36 Buyer\u2019s Checklist for Gun Dogs",
    "breed": "Cocker Spaniels",
    "price": "1250",
    "posted_date": "10-01-2026",
    "posted_date_iso": "2026-01-10",
    "last_updated": "24-01-2026",
    "date_of_birth": "8 Dec 2025",
    "location": "Middlesbrough",
    "seller_name": "Jordan Morrow",
    "member_since": "1st November 2024",
    "verified_breeder": false,
    "health_checked": false,
    "hip_scored": false,
    "elbow_scored": false,
    "eye_tested": false,
    "vaccinated": false,
    "microchipped": false,
    "wormed": true,
    "kc_registered": false,
    "original_breeder": true,
    "viewable_with_mother": true
  },
  {
    "url": "https://gundogsdirect.co.uk/dogs-for-sale/labradors-for-sale/labrador-puppies-for-sale/31068",
    "id": "31068",
    "platform": "gundogs_direct",
    "scraped_at": "2026-01-24T20:37:23.250594",
    "title": "\ud83d\udc36 Buyer\u2019s Checklist for Gun Dogs",
    "breed": "Labradors",
    "price": "1000",
    "posted_date": "10-01-2026",
    "posted_date_iso": "2026-01-10",
    "last_updated": "24-01-2026",
    "date_of_birth": "7 Dec 2025",
    "location": "Clevedon",
    "seller_name": "Madrun Parry-Jones",
    "member_since": "24th September 2024",
    "verified_breeder": false,
    "health_checked": false,
    "hip_scored": false,
    "elbow_scored": false,
    "eye_tested": false,
    "vaccinated": false,
    "microchipped": false,
    "wormed": true,
    "kc_registered": false,
    "original_breeder": true,
    "viewable_with_mother": true
  },
  {
    "url": "https://gundogsdirect.co.uk/dogs-for-sale/cross-breed-dogs/cross-breed-dogs-puppies/31065",
    "id": "31065",
    "platform": "gundogs_direct",
    "scraped_at": "2026-01-24T20:37:25.861722",
    "title": "\ud83d\udc36 Buyer\u2019s Checklist for Gun Dogs",
    "price": "600",
    "posted_date": "09-01-2026",
    "posted_date_iso": "2026-01-09",
    "last_updated": "24-01-2026",
    "date_of_birth": "2 Dec 2025",
    "location": "Humber",
    "seller_name": "Brett Bartram",
    "member_since": "26th October 2024",
    "verified_breeder": false,
    "health_checked": false,
    "hip_scored": false,
    "elbow_scored": false,
    "eye_tested": false,
    "vaccinated": false,
    "microchipped": false,
    "wormed": true,
    "kc_registered": false,
    "original_breeder": true,
    "viewable_with_mother": true
  },
  {
    "url": "https://gundogsdirect.co.uk/dogs-for-sale/labradors-for-sale/labrador-puppies-for-sale/31064",
    "id": "31064",
    "platform": "gundogs_direct",
    "scraped_at": "2026-01-24T20:37:28.400301",
    "title": "\ud83d\udc36 Buyer\u2019s Checklist for Gun Dogs",
    "breed": "Labradors",
    "price": "1600",
    "posted_date": "09-01-2026",
    "posted_date_iso": "2026-01-09",
    "last_updated": "24-01-2026",
    "litter_size": 4,
    "date_of_birth": "17 Nov 2025",
    "location": "Havant",
    "seller_name": "Megan Naylor",
    "member_since": "28th December 2025",
    "verified_breeder": false,
    "health_checked": false,
    "hip_scored": false,
    "elbow_scored": false,
    "eye_tested": false,
    "vaccinated": false,
    "microchipped": false,
    "wormed": true,
    "kc_registered": false,
    "original_breeder": true,
    "viewable_with_mother": true
  },
  {
    "url": "https://gundogsdirect.co.uk/dogs-for-sale/cocker-spaniels-for-sale/cocker-spaniel-puppies/31063",
    "id": "31063",
    "platform": "gundogs_direct",
    "scraped_at": "2026-01-24T20:37:30.985495",
    "title": "\ud83d\udc36 Buyer\u2019s Checklist for Gun Dogs",
    "breed": "Cocker Spaniels",
    "price": "1300",
    "posted_date": "09-01-2026",
    "posted_date_iso": "2026-01-09",
    "last_updated": "24-01-2026",
    "available_puppies": 2,
    "date_of_birth": "7 Jan 2026",
    "location": "Tyne",
    "seller_name": "Danielle Scott",
    "member_since": "10th June 2025",
    "verified_breeder": false,
    "health_checked": true,
    "hip_scored": false,
    "elbow_scored": false,
    "eye_tested": false,
    "vaccinated": false,
    "microchipped": false,
    "wormed": true,
    "kc_registered": false,
    "original_breeder": true,
    "viewable_with_mother": true
  },
  {
    "url": "https://gundogsdirect.co.uk/dogs-for-sale/other-pure-breed/other-pure-breed-puppies/31061",
    "id": "31061",
    "platform": "gundogs_direct",
    "scraped_at": "2026-01-24T20:37:33.531602",
    "title": "\ud83d\udc36 Buyer\u2019s Checklist for Gun Dogs",
    "price": "2000",
    "posted_date": "09-01-2026",
    "posted_date_iso": "2026-01-09",
    "last_updated": "24-01-2026",
    "date_of_birth": "28 Nov 2025",
    "location": "Clevedon",
    "seller_name": "JJ B",
    "member_since": "30th April 2024",
    "verified_breeder": false,
    "health_checked": true,
    "hip_scored": false,
    "elbow_scored": false,
    "eye_tested": false,
    "vaccinated": false,
    "microchipped": false,
    "wormed": true,
    "kc_registered": false,
    "original_breeder": true,
    "viewable_with_mother": true
  },
  {
    "url": "https://gundogsdirect.co.uk/dogs-for-sale/cocker-spaniels-for-sale/part-trained-cocker-spaniels/31058",
    "id": "31058",
    "platform": "gundogs_direct",
    "scraped_at": "2026-01-24T20:37:36.077701",
    "title": "\ud83d\udc36 Buyer\u2019s Checklist for Gun Dogs",
    "breed": "Cocker Spaniels",
    "price": "2000",
    "posted_date": "08-01-2026",
    "posted_date_iso": "2026-01-08",
    "last_updated": "24-01-2026",
    "date_of_birth": "12 Sep 2024",
    "location": "Wrexham",
    "seller_name": "Dan Lovell",
    "member_since": "8th January 2026",
    "verified_breeder": false,
    "health_checked": true,
    "hip_scored": false,
    "elbow_scored": false,
    "eye_tested": false,
    "vaccinated": false,
    "microchipped": false,
    "wormed": true,
    "kc_registered": false,
    "original_breeder": true,
    "viewable_with_mother": true
  },
  {
    "url": "https://gundogsdirect.co.uk/dogs-for-sale/labradors-for-sale/labrador-puppies-for-sale/31057",
    "id": "31057",
    "platform": "gundogs_direct",
    "scraped_at": "2026-01-24T20:37:38.687257",
    "title": "\ud83d\udc36 Buyer\u2019s Checklist for Gun Dogs",
    "breed": "Labradors",
    "price": "1500",
    "posted_date": "08-01-2026",
    "posted_date_iso": "2026-01-08",
    "last_updated": "24-01-2026",
    "date_of_birth": "8 Jan 2026",
    "location": "Preston",
    "seller_name": "Caitlin Deluce",
    "member_since": "6th June 2025",
    "verified_breeder": false,
    "health_checked": false,
    "hip_scored": false,
    "elbow_scored": false,
    "eye_tested": false,
    "vaccinated": false,
    "microchipped": false,
    "wormed": true,
    "kc_registered": false,
    "original_breeder": true,
    "viewable_with_mother": true
  },
  {
    "url": "https://gundogsdirect.co.uk/dogs-for-sale/cocker-spaniels-for-sale/cocker-spaniel-puppies/31052",
    "id": "31052",
    "platform": "gundogs_direct",
    "scraped_at": "2026-01-24T20:37:41.182922",
    "title": "\ud83d\udc36 Buyer\u2019s Checklist for Gun Dogs",
    "breed": "Cocker Spaniels",
    "price": "800",
    "posted_date": "07-01-2026",
    "posted_date_iso": "2026-01-07",
    "last_updated": "24-01-2026",
    "date_of_birth": "9 Dec 2025",
    "location": "Hartlepool",
    "seller_name": "Christine Barrone",
    "member_since": "7th January 2026",
    "verified_breeder": false,
    "health_checked": false,
    "hip_scored": false,
    "elbow_scored": false,
    "eye_tested": false,
    "vaccinated": false,
    "microchipped": false,
    "wormed": true,
    "kc_registered": false,
    "original_breeder": true,
    "viewable_with_mother": true
  },
  {
    "url": "https://gundogsdirect.co.uk/dogs-for-sale/teckel/teckel-puppies/31050",
    "id": "31050",
    "platform": "gundogs_direct",
    "scraped_at": "2026-01-24T20:37:43.723741",
    "title": "\ud83d\udc36 Buyer\u2019s Checklist for Gun Dogs",
    "price": "1000",
    "posted_date": "07-01-2026",
    "posted_date_iso": "2026-01-07",
    "last_updated": "24-01-2026",
    "date_of_birth": "28 Nov 2025",
    "location": "Clevedon",
    "seller_name": "Amy Sharratt",
    "member_since": "26th October 2024",
    "verified_breeder": false,
    "health_checked": false,
    "hip_scored": false,
    "elbow_scored": false,
    "eye_tested": false,
    "vaccinated": false,
    "microchipped": false,
    "wormed": true,
    "kc_registered": false,
    "original_breeder": true,
    "viewable_with_mother": true
  },
  {
    "url": "https://gundogsdirect.co.uk/dogs-for-sale/teckel/teckel-puppies/31049",
    "id": "31049",
    "platform": "gundogs_direct",
    "scraped_at": "2026-01-24T20:37:46.282431",
    "title": "\ud83d\udc36 Buyer\u2019s Checklist for Gun Dogs",
    "price": "1100",
    "posted_date": "07-01-2026",
    "posted_date_iso": "2026-01-07",
    "last_updated": "24-01-2026",
    "date_of_birth": "22 Nov 2025",
    "location": "Dartford",
    "seller_name": "Polly Bishop",
    "member_since": "3rd January 2026",
    "verified_breeder": false,
    "health_checked": false,
    "hip_scored": false,
    "elbow_scored": false,
    "eye_tested": false,
    "vaccinated": false,
    "microchipped": false,
    "wormed": true,
    "kc_registered": false,
    "original_breeder": true,
    "viewable_with_mother": true
  },
  {
    "url": "https://gundogsdirect.co.uk/dogs-for-sale/labradors-for-sale/labradors-at-stud/31048",
    "id": "31048",
    "platform": "gundogs_direct",
    "scraped_at": "2026-01-24T20:37:48.841972",
    "title": "\ud83d\udc36 Buyer\u2019s Checklist for Gun Dogs",
    "breed": "Labradors",
    "price": "400",
    "posted_date": "07-01-2026",
    "posted_date_iso": "2026-01-07",
    "last_updated": "24-01-2026",
    "date_of_birth": "16 Jan 2021",
    "location": "Lymington",
    "seller_name": "Owen Phillips",
    "member_since": "30th April 2024",
    "verified_breeder": false,
    "health_checked": true,
    "hip_scored": false,
    "elbow_scored": false,
    "eye_tested": false,
    "vaccinated": false,
    "microchipped": false,
    "wormed": true,
    "kc_registered": false,
    "original_breeder": true,
    "viewable_with_mother": false
  },
  {
    "url": "https://gundogsdirect.co.uk/dogs-for-sale/labradors-for-sale/labrador-puppies-for-sale/31047",
    "id": "31047",
    "platform": "gundogs_direct",
    "scraped_at": "2026-01-24T20:37:51.330956",
    "title": "\ud83d\udc36 Buyer\u2019s Checklist for Gun Dogs",
    "breed": "Labradors",
    "price": "1500",
    "posted_date": "07-01-2026",
    "posted_date_iso": "2026-01-07",
    "last_updated": "24-01-2026",
    "date_of_birth": "30 Nov 2025",
    "location": "Horsham",
    "seller_name": "Olivia Lepine",
    "member_since": "15th August 2024",
    "verified_breeder": false,
    "health_checked": true,
    "hip_scored": false,
    "elbow_scored": false,
    "eye_tested": false,
    "vaccinated": false,
    "microchipped": false,
    "wormed": true,
    "kc_registered": false,
    "original_breeder": true,
    "viewable_with_mother": true
  },
  {
    "url": "https://gundogsdirect.co.uk/dogs-for-sale/cocker-spaniels-for-sale/part-trained-cocker-spaniels/31044",
    "id": "31044",
    "platform": "gundogs_direct",
    "scraped_at": "2026-01-24T20:37:53.925064",
    "title": "\ud83d\udc36 Buyer\u2019s Checklist for Gun Dogs",
    "breed": "Cocker Spaniels",
    "price": "3000",
    "posted_date": "06-01-2026",
    "posted_date_iso": "2026-01-06",
    "last_updated": "24-01-2026",
    "date_of_birth": "19 Aug 2024",
    "location": "Pewsey",
    "seller_name": "Angharad Beck",
    "member_since": "6th January 2026",
    "verified_breeder": false,
    "health_checked": true,
    "hip_scored": false,
    "elbow_scored": false,
    "eye_tested": false,
    "vaccinated": false,
    "microchipped": false,
    "wormed": true,
    "kc_registered": false,
    "original_breeder": false,
    "viewable_with_mother": false
  },
  {
    "url": "https://gundogsdirect.co.uk/dogs-for-sale/labradors-for-sale/labrador-puppies-for-sale/31042",
    "id": "31042",
    "platform": "gundogs_direct",
    "scraped_at": "2026-01-24T20:37:56.474463",
    "title": "\ud83d\udc36 Buyer\u2019s Checklist for Gun Dogs",
    "breed": "Labradors",
    "price": "1500",
    "posted_date": "06-01-2026",
    "posted_date_iso": "2026-01-06",
    "last_updated": "24-01-2026",
    "date_of_birth": "23 Dec 2025",
    "location": "Leicestershire",
    "seller_name": "Derrick Capel",
    "member_since": "5th May 2024",
    "verified_breeder": false,
    "health_checked": true,
    "hip_scored": false,
    "elbow_scored": false,
    "eye_tested": false,
    "vaccinated": false,
    "microchipped": false,
    "wormed": true,
    "kc_registered": false,
    "original_breeder": true,
    "viewable_with_mother": true
  },
  {
    "url": "https://gundogsdirect.co.uk/dogs-for-sale/cocker-spaniels-for-sale/cocker-spaniel-at-stud/31039",
    "id": "31039",
    "platform": "gundogs_direct",
    "scraped_at": "2026-01-24T20:37:58.949854",
    "title": "\ud83d\udc36 Buyer\u2019s Checklist for Gun Dogs",
    "breed": "Cocker Spaniels",
    "price": "600",
    "posted_date": "05-01-2026",
    "posted_date_iso": "2026-01-05",
    "last_updated": "24-01-2026",
    "date_of_birth": "23 Aug 2019",
    "location": "Ashford",
    "seller_name": "Francis Briley",
    "member_since": "30th April 2024",
    "verified_breeder": false,
    "health_checked": true,
    "hip_scored": false,
    "elbow_scored": false,
    "eye_tested": false,
    "vaccinated": false,
    "microchipped": false,
    "wormed": true,
    "kc_registered": false,
    "original_breeder": false,
    "viewable_with_mother": false
  },
  {
    "url": "https://gundogsdirect.co.uk/dogs-for-sale/labradors-for-sale/part-trained-labradors/31038",
    "id": "31038",
    "platform": "gundogs_direct",
    "scraped_at": "2026-01-24T20:38:01.428493",
    "title": "\ud83d\udc36 Buyer\u2019s Checklist for Gun Dogs",
    "breed": "Labradors",
    "price": "1400",
    "posted_date": "05-01-2026",
    "posted_date_iso": "2026-01-05",
    "last_updated": "24-01-2026",
    "location": "Corwen",
    "seller_name": "Danny Stewart",
    "member_since": "31st March 2025",
    "verified_breeder": false,
    "health_checked": false,
    "hip_scored": false,
    "elbow_scored": false,
    "eye_tested": false,
    "vaccinated": false,
    "microchipped": false,
    "wormed": true,
    "kc_registered": false,
    "original_breeder": true,
    "viewable_with_mother": true
  },
  {
    "url": "https://gundogsdirect.co.uk/dogs-for-sale/labradors-for-sale/labrador-puppies-for-sale/31034",
    "id": "31034",
    "platform": "gundogs_direct",
    "scraped_at": "2026-01-24T20:38:04.003445",
    "title": "\ud83d\udc36 Buyer\u2019s Checklist for Gun Dogs",
    "breed": "Labradors",
    "price": "1650",
    "posted_date": "04-01-2026",
    "posted_date_iso": "2026-01-04",
    "last_updated": "24-01-2026",
    "date_of_birth": "21 Nov 2025",
    "location": "Driffield",
    "seller_name": "Teresa Middlewood",
    "member_since": "18th May 2024",
    "verified_breeder": false,
    "health_checked": false,
    "hip_scored": false,
    "elbow_scored": false,
    "eye_tested": false,
    "vaccinated": false,
    "microchipped": false,
    "wormed": true,
    "kc_registered": false,
    "original_breeder": true,
    "viewable_with_mother": true
  },
  {
    "url": "https://gundogsdirect.co.uk/dogs-for-sale/labradors-for-sale/labrador-puppies-for-sale/31033",
    "id": "31033",
    "platform": "gundogs_direct",
    "scraped_at": "2026-01-24T20:38:06.523109",
    "title": "\ud83d\udc36 Buyer\u2019s Checklist for Gun Dogs",
    "breed": "Labradors",
    "price": "1450",
    "posted_date": "04-01-2026",
    "posted_date_iso": "2026-01-04",
    "last_updated": "24-01-2026",
    "date_of_birth": "28 Nov 2025",
    "location": "Driffield",
    "seller_name": "Teresa Middlewood",
    "member_since": "18th May 2024",
    "verified_breeder": false,
    "health_checked": false,
    "hip_scored": false,
    "elbow_scored": false,
    "eye_tested": false,
    "vaccinated": false,
    "microchipped": false,
    "wormed": true,
    "kc_registered": false,
    "original_breeder": true,
    "viewable_with_mother": true
  },
  {
    "url": "https://gundogsdirect.co.uk/dogs-for-sale/labradors-for-sale/labrador-puppies-for-sale/31032",
    "id": "31032",
    "platform": "gundogs_direct",
    "scraped_at": "2026-01-24T20:38:08.977014",
    "title": "\ud83d\udc36 Buyer\u2019s Checklist for Gun Dogs",
    "breed": "Labradors",
    "price": "850",
    "posted_date": "04-01-2026",
    "posted_date_iso": "2026-01-04",
    "last_updated": "24-01-2026",
    "date_of_birth": "5 Nov 2025",
    "location": "Clevedon",
    "seller_name": "Dave Miller",
    "member_since": "30th January 2025",
    "verified_breeder": false,
    "health_checked": true,
    "hip_scored": false,
    "elbow_scored": false,
    "eye_tested": false,
    "vaccinated": false,
    "microchipped": false,
    "wormed": true,
    "kc_registered": false,
    "original_breeder": true,
    "viewable_with_mother": true
  },
  {
    "url": "https://gundogsdirect.co.uk/dogs-for-sale/teckel/teckel-puppies/31031",
    "id": "31031",
    "platform": "gundogs_direct",
    "scraped_at": "2026-01-24T20:38:11.535544",
    "title": "\ud83d\udc36 Buyer\u2019s Checklist for Gun Dogs",
    "price": "1200",
    "posted_date": "03-01-2026",
    "posted_date_iso": "2026-01-03",
    "last_updated": "24-01-2026",
    "location": "Northern Ireland",
    "seller_name": "Steven Mcgonigal",
    "member_since": "3rd January 2026",
    "verified_breeder": false,
    "health_checked": true,
    "hip_scored": false,
    "elbow_scored": false,
    "eye_tested": false,
    "vaccinated": false,
    "microchipped": false,
    "wormed": true,
    "kc_registered": false,
    "original_breeder": true,
    "viewable_with_mother": true
  },
  {
    "url": "https://gundogsdirect.co.uk/dogs-for-sale/labradors-for-sale/labrador-puppies-for-sale/31029",
    "id": "31029",
    "platform": "gundogs_direct",
    "scraped_at": "2026-01-24T20:38:13.962576",
    "title": "\ud83d\udc36 Buyer\u2019s Checklist for Gun Dogs",
    "breed": "Labradors",
    "price": "1200",
    "posted_date": "03-01-2026",
    "posted_date_iso": "2026-01-03",
    "last_updated": "24-01-2026",
    "date_of_birth": "27 Dec 2025",
    "ready_to_leave": "21st February\u00a0\n\n0781",
    "location": "Scarborough",
    "seller_name": "Martin Mitchell",
    "member_since": "29th December 2025",
    "verified_breeder": false,
    "health_checked": true,
    "hip_scored": false,
    "elbow_scored": false,
    "eye_tested": false,
    "vaccinated": false,
    "microchipped": false,
    "wormed": true,
    "kc_registered": false,
    "original_breeder": true,
    "viewable_with_mother": true
  },
  {
    "url": "https://gundogsdirect.co.uk/dogs-for-sale/labradors-for-sale/labrador-puppies-for-sale/31024",
    "id": "31024",
    "platform": "gundogs_direct",
    "scraped_at": "2026-01-24T20:38:16.402599",
    "title": "\ud83d\udc36 Buyer\u2019s Checklist for Gun Dogs",
    "breed": "Labradors",
    "price": "1250",
    "posted_date": "02-01-2026",
    "posted_date_iso": "2026-01-02",
    "last_updated": "24-01-2026",
    "date_of_birth": "30 Oct 2025",
    "location": "Kingsbridge",
    "seller_name": "Charles Smith",
    "member_since": "2nd January 2026",
    "verified_breeder": false,
    "health_checked": false,
    "hip_scored": false,
    "elbow_scored": false,
    "eye_tested": false,
    "vaccinated": false,
    "microchipped": false,
    "wormed": true,
    "kc_registered": false,
    "original_breeder": true,
    "viewable_with_mother": true
  },
  {
    "url": "https://gundogsdirect.co.uk/dogs-for-sale/springer-spaniels-for-sale/springer-spaniel-puppies/31018",
    "id": "31018",
    "platform": "gundogs_direct",
    "scraped_at": "2026-01-24T20:38:19.018083",
    "title": "\ud83d\udc36 Buyer\u2019s Checklist for Gun Dogs",
    "breed": "Springer Spaniels",
    "price": "850",
    "posted_date": "01-01-2026",
    "posted_date_iso": "2026-01-01",
    "last_updated": "24-01-2026",
    "age": "18",
    "location": "Hayle",
    "seller_name": "Mark Jones",
    "member_since": "28th September 2025",
    "verified_breeder": false,
    "health_checked": false,
    "hip_scored": false,
    "elbow_scored": false,
    "eye_tested": false,
    "vaccinated": false,
    "microchipped": false,
    "wormed": true,
    "kc_registered": false,
    "original_breeder": true,
    "viewable_with_mother": true
  },
  {
    "url": "https://gundogsdirect.co.uk/dogs-for-sale/golden-retriever/golden-retriever-stud/31014",
    "id": "31014",
    "platform": "gundogs_direct",
    "scraped_at": "2026-01-24T20:38:21.511178",
    "title": "\ud83d\udc36 Buyer\u2019s Checklist for Gun Dogs",
    "price": "900",
    "posted_date": "31-12-2025",
    "posted_date_iso": "2025-12-31",
    "last_updated": "24-01-2026",
    "date_of_birth": "30 Jun 2022",
    "location": "Falkirk",
    "seller_name": "lewis macneill",
    "member_since": "30th April 2024",
    "verified_breeder": false,
    "health_checked": true,
    "hip_scored": false,
    "elbow_scored": false,
    "eye_tested": false,
    "vaccinated": false,
    "microchipped": false,
    "wormed": true,
    "kc_registered": false,
    "original_breeder": true,
    "viewable_with_mother": false
  },
  {
    "url": "https://gundogsdirect.co.uk/dogs-for-sale/springer-spaniels-for-sale/springer-spaniel-puppies/31013",
    "id": "31013",
    "platform": "gundogs_direct",
    "scraped_at": "2026-01-24T20:38:23.975786",
    "title": "\ud83d\udc36 Buyer\u2019s Checklist for Gun Dogs",
    "breed": "Springer Spaniels",
    "price": "1000",
    "posted_date": "31-12-2025",
    "posted_date_iso": "2025-12-31",
    "last_updated": "24-01-2026",
    "date_of_birth": "12 Nov 2025",
    "ready_to_leave": "7th January",
    "location": "Middlesbrough",
    "seller_name": "Emily-jayne Grange",
    "member_since": "31st December 2025",
    "verified_breeder": false,
    "health_checked": false,
    "hip_scored": false,
    "elbow_scored": false,
    "eye_tested": false,
    "vaccinated": false,
    "microchipped": false,
    "wormed": true,
    "kc_registered": false,
    "original_breeder": true,
    "viewable_with_mother": true
  },
  {
    "url": "https://gundogsdirect.co.uk/dogs-for-sale/cocker-spaniels-for-sale/cocker-spaniel-at-stud/31011",
    "id": "31011",
    "platform": "gundogs_direct",
    "scraped_at": "2026-01-24T20:38:26.408550",
    "title": "\ud83d\udc36 Buyer\u2019s Checklist for Gun Dogs",
    "breed": "Cocker Spaniels",
    "price": "350",
    "posted_date": "30-12-2025",
    "posted_date_iso": "2025-12-30",
    "last_updated": "24-01-2026",
    "date_of_birth": "1 Dec 2023",
    "location": "Avon",
    "seller_name": "Amanda Bishop",
    "member_since": "30th April 2024",
    "verified_breeder": false,
    "health_checked": true,
    "hip_scored": false,
    "elbow_scored": false,
    "eye_tested": false,
    "vaccinated": false,
    "microchipped": false,
    "wormed": true,
    "kc_registered": false,
    "original_breeder": true,
    "viewable_with_mother": false
  },
  {
    "url": "https://gundogsdirect.co.uk/dogs-for-sale/cocker-spaniels-for-sale/cocker-spaniel-puppies/31008",
    "id": "31008",
    "platform": "gundogs_direct",
    "scraped_at": "2026-01-24T20:38:28.935720",
    "title": "\ud83d\udc36 Buyer\u2019s Checklist for Gun Dogs",
    "breed": "Cocker Spaniels",
    "price": "1350",
    "posted_date": "30-12-2025",
    "posted_date_iso": "2025-12-30",
    "last_updated": "24-01-2026",
    "date_of_birth": "12 Nov 2025",
    "ready_to_leave": "6th Jan",
    "location": "Braintree",
    "seller_name": "Leanne Aird",
    "member_since": "30th December 2025",
    "verified_breeder": false,
    "health_checked": true,
    "hip_scored": false,
    "elbow_scored": false,
    "eye_tested": false,
    "vaccinated": false,
    "microchipped": false,
    "wormed": true,
    "kc_registered": false,
    "original_breeder": true,
    "viewable_with_mother": true
  },
  {
    "url": "https://gundogsdirect.co.uk/dogs-for-sale/cocker-spaniels-for-sale/part-trained-cocker-spaniels/31006",
    "id": "31006",
    "platform": "gundogs_direct",
    "scraped_at": "2026-01-24T20:38:31.424887",
    "title": "\ud83d\udc36 Buyer\u2019s Checklist for Gun Dogs",
    "breed": "Cocker Spaniels",
    "price": "4500",
    "posted_date": "29-12-2025",
    "posted_date_iso": "2025-12-29",
    "last_updated": "24-01-2026",
    "date_of_birth": "8 Dec 2024",
    "location": "East Yorkshire",
    "seller_name": "Stuart Brown",
    "member_since": "20th February 2025",
    "verified_breeder": false,
    "health_checked": false,
    "hip_scored": false,
    "elbow_scored": false,
    "eye_tested": false,
    "vaccinated": false,
    "microchipped": true,
    "wormed": true,
    "kc_registered": false,
    "original_breeder": false,
    "viewable_with_mother": false
  },
  {
    "url": "https://gundogsdirect.co.uk/dogs-for-sale/springer-spaniels-for-sale/springer-spaniel-puppies/30994",
    "id": "30994",
    "platform": "gundogs_direct",
    "scraped_at": "2026-01-24T20:38:34.059871",
    "title": "\ud83d\udc36 Buyer\u2019s Checklist for Gun Dogs",
    "breed": "Springer Spaniels",
    "price": "950",
    "posted_date": "27-12-2025",
    "posted_date_iso": "2025-12-27",
    "last_updated": "24-01-2026",
    "date_of_birth": "26 Nov 2025",
    "location": "Nantwich",
    "seller_name": "Josh Warburton",
    "member_since": "27th December 2025",
    "verified_breeder": false,
    "health_checked": false,
    "hip_scored": false,
    "elbow_scored": false,
    "eye_tested": false,
    "vaccinated": false,
    "microchipped": false,
    "wormed": true,
    "kc_registered": false,
    "original_breeder": true,
    "viewable_with_mother": true
  },
  {
    "url": "https://gundogsdirect.co.uk/dogs-for-sale/cocker-spaniels-for-sale/cocker-spaniel-at-stud/30992",
    "id": "30992",
    "platform": "gundogs_direct",
    "scraped_at": "2026-01-24T20:38:36.522049",
    "title": "\ud83d\udc36 Buyer\u2019s Checklist for Gun Dogs",
    "breed": "Cocker Spaniels",
    "price": "400",
    "posted_date": "27-12-2025",
    "posted_date_iso": "2025-12-27",
    "last_updated": "24-01-2026",
    "date_of_birth": "19 Jan 2021",
    "location": "York",
    "seller_name": "Ryan Kay",
    "member_since": "30th April 2024",
    "verified_breeder": false,
    "health_checked": true,
    "hip_scored": false,
    "elbow_scored": false,
    "eye_tested": false,
    "vaccinated": false,
    "microchipped": false,
    "wormed": true,
    "kc_registered": false,
    "original_breeder": true,
    "viewable_with_mother": false
  },
  {
    "url": "https://gundogsdirect.co.uk/dogs-for-sale/cocker-spaniels-for-sale/part-trained-cocker-spaniels/30991",
    "id": "30991",
    "platform": "gundogs_direct",
    "scraped_at": "2026-01-24T20:38:38.994940",
    "title": "\ud83d\udc36 Buyer\u2019s Checklist for Gun Dogs",
    "breed": "Cocker Spaniels",
    "price": "6000",
    "posted_date": "27-12-2025",
    "posted_date_iso": "2025-12-27",
    "last_updated": "24-01-2026",
    "date_of_birth": "27 May 2024",
    "location": "Clevedon",
    "seller_name": "Ulrika Marwick",
    "member_since": "4th February 2025",
    "verified_breeder": false,
    "health_checked": false,
    "hip_scored": false,
    "elbow_scored": false,
    "eye_tested": false,
    "vaccinated": false,
    "microchipped": false,
    "wormed": false,
    "kc_registered": false,
    "original_breeder": false,
    "viewable_with_mother": false
  },
  {
    "url": "https://gundogsdirect.co.uk/dogs-for-sale/cocker-spaniels-for-sale/cocker-spaniel-at-stud/30990",
    "id": "30990",
    "platform": "gundogs_direct",
    "scraped_at": "2026-01-24T20:38:41.431061",
    "title": "\ud83d\udc36 Buyer\u2019s Checklist for Gun Dogs",
    "breed": "Cocker Spaniels",
    "price": "450",
    "posted_date": "26-12-2025",
    "posted_date_iso": "2025-12-26",
    "last_updated": "24-01-2026",
    "date_of_birth": "25 Apr 2023",
    "location": "York",
    "seller_name": "Ryan Kay",
    "member_since": "30th April 2024",
    "verified_breeder": false,
    "health_checked": true,
    "hip_scored": false,
    "elbow_scored": false,
    "eye_tested": false,
    "vaccinated": false,
    "microchipped": false,
    "wormed": true,
    "kc_registered": false,
    "original_breeder": false,
    "viewable_with_mother": false
  },
  {
    "url": "https://gundogsdirect.co.uk/dogs-for-sale/cocker-spaniels-for-sale/cocker-spaniel-puppies/30988",
    "id": "30988",
    "platform": "gundogs_direct",
    "scraped_at": "2026-01-24T20:38:44.192229",
    "title": "\ud83d\udc36 Buyer\u2019s Checklist for Gun Dogs",
    "breed": "Cocker Spaniels",
    "price": "800",
    "posted_date": "26-12-2025",
    "posted_date_iso": "2025-12-26",
    "last_updated": "24-01-2026",
    "date_of_birth": "29 Oct 2025",
    "location": "Clevedon",
    "seller_name": "Alan Price",
    "member_since": "14th September 2024",
    "verified_breeder": false,
    "health_checked": true,
    "hip_scored": false,
    "elbow_scored": false,
    "eye_tested": false,
    "vaccinated": false,
    "microchipped": false,
    "wormed": true,
    "kc_registered": false,
    "original_breeder": true,
    "viewable_with_mother": true
  },
  {
    "url": "https://gundogsdirect.co.uk/dogs-for-sale/cocker-spaniels-for-sale/trained-cocker-spaniels/30984",
    "id": "30984",
    "platform": "gundogs_direct",
    "scraped_at": "2026-01-24T20:38:46.741795",
    "title": "\ud83d\udc36 Buyer\u2019s Checklist for Gun Dogs",
    "breed": "Cocker Spaniels",
    "price": "3000",
    "posted_date": "25-12-2025",
    "posted_date_iso": "2025-12-25",
    "last_updated": "24-01-2026",
    "date_of_birth": "26 Feb 2021",
    "location": "Aberdare",
    "seller_name": "Jeremy Buchanan",
    "member_since": "30th April 2024",
    "verified_breeder": false,
    "health_checked": false,
    "hip_scored": false,
    "elbow_scored": false,
    "eye_tested": false,
    "vaccinated": false,
    "microchipped": false,
    "wormed": true,
    "kc_registered": false,
    "original_breeder": true,
    "viewable_with_mother": true
  },
  {
    "url": "https://gundogsdirect.co.uk/dogs-for-sale/labradors-for-sale/labrador-puppies-for-sale/30979",
    "id": "30979",
    "platform": "gundogs_direct",
    "scraped_at": "2026-01-24T20:38:49.198944",
    "title": "\ud83d\udc36 Buyer\u2019s Checklist for Gun Dogs",
    "breed": "Labradors",
    "price": "800",
    "posted_date": "23-12-2025",
    "posted_date_iso": "2025-12-23",
    "last_updated": "24-01-2026",
    "date_of_birth": "29 Oct 2025",
    "location": "Daventry",
    "seller_name": "Chris New",
    "member_since": "23rd December 2025",
    "verified_breeder": false,
    "health_checked": false,
    "hip_scored": false,
    "elbow_scored": false,
    "eye_tested": false,
    "vaccinated": false,
    "microchipped": false,
    "wormed": true,
    "kc_registered": false,
    "original_breeder": true,
    "viewable_with_mother": true
  },
  {
    "url": "https://gundogsdirect.co.uk/dogs-for-sale/cocker-spaniels-for-sale/cocker-spaniel-puppies/30971",
    "id": "30971",
    "platform": "gundogs_direct",
    "scraped_at": "2026-01-24T20:38:51.692912",
    "title": "\ud83d\udc36 Buyer\u2019s Checklist for Gun Dogs",
    "breed": "Cocker Spaniels",
    "price": "1400",
    "posted_date": "21-12-2025",
    "posted_date_iso": "2025-12-21",
    "last_updated": "24-01-2026",
    "date_of_birth": "15 Nov 2025",
    "location": "Aberdeenshire",
    "seller_name": "Lisa Brown",
    "member_since": "2nd August 2024",
    "verified_breeder": false,
    "health_checked": true,
    "hip_scored": false,
    "elbow_scored": false,
    "eye_tested": false,
    "vaccinated": false,
    "microchipped": false,
    "wormed": true,
    "kc_registered": false,
    "original_breeder": true,
    "viewable_with_mother": true
  },
  {
    "url": "https://gundogsdirect.co.uk/dogs-for-sale/other-pure-breed/other-pure-breed-puppies/30963",
    "id": "30963",
    "platform": "gundogs_direct",
    "scraped_at": "2026-01-24T20:38:54.222565",
    "title": "\ud83d\udc36 Buyer\u2019s Checklist for Gun Dogs",
    "price": "2500",
    "posted_date": "19-12-2025",
    "posted_date_iso": "2025-12-19",
    "last_updated": "24-01-2026",
    "date_of_birth": "3 Nov 2025",
    "location": "Harrogate",
    "seller_name": "Sarah Langford",
    "member_since": "30th April 2024",
    "verified_breeder": false,
    "health_checked": true,
    "hip_scored": false,
    "elbow_scored": false,
    "eye_tested": false,
    "vaccinated": false,
    "microchipped": false,
    "wormed": true,
    "kc_registered": false,
    "original_breeder": false,
    "viewable_with_mother": false
  },
  {
    "url": "https://gundogsdirect.co.uk/dogs-for-sale/cocker-spaniels-for-sale/cocker-spaniel-at-stud/30959",
    "id": "30959",
    "platform": "gundogs_direct",
    "scraped_at": "2026-01-24T20:38:56.713144",
    "title": "\ud83d\udc36 Buyer\u2019s Checklist for Gun Dogs",
    "breed": "Cocker Spaniels",
    "price": "300",
    "posted_date": "18-12-2025",
    "posted_date_iso": "2025-12-18",
    "last_updated": "24-01-2026",
    "location": "Ipswich",
    "seller_name": "Karen manning",
    "member_since": "30th April 2024",
    "verified_breeder": false,
    "health_checked": true,
    "hip_scored": false,
    "elbow_scored": false,
    "eye_tested": false,
    "vaccinated": false,
    "microchipped": false,
    "wormed": true,
    "kc_registered": false,
    "original_breeder": true,
    "viewable_with_mother": false
  },
  {
    "url": "https://gundogsdirect.co.uk/dogs-for-sale/springer-spaniels-for-sale/springer-spaniels-at-stud/30954",
    "id": "30954",
    "platform": "gundogs_direct",
    "scraped_at": "2026-01-24T20:38:59.194514",
    "title": "\ud83d\udc36 Buyer\u2019s Checklist for Gun Dogs",
    "breed": "Springer Spaniels",
    "price": "300",
    "posted_date": "18-12-2025",
    "posted_date_iso": "2025-12-18",
    "last_updated": "24-01-2026",
    "location": "Mansfield",
    "seller_name": "Dave Williams",
    "member_since": "30th April 2024",
    "verified_breeder": false,
    "health_checked": true,
    "hip_scored": false,
    "elbow_scored": false,
    "eye_tested": false,
    "vaccinated": false,
    "microchipped": false,
    "wormed": true,
    "kc_registered": false,
    "original_breeder": true,
    "viewable_with_mother": false
  },
  {
    "url": "https://gundogsdirect.co.uk/dogs-for-sale/hungarian-visla/hungarian-visla-stud/30950",
    "id": "30950",
    "platform": "gundogs_direct",
    "scraped_at": "2026-01-24T20:39:01.684699",
    "title": "\ud83d\udc36 Buyer\u2019s Checklist for Gun Dogs",
    "price": "1000",
    "posted_date": "17-12-2025",
    "posted_date_iso": "2025-12-17",
    "last_updated": "24-01-2026",
    "date_of_birth": "3 Feb 2019",
    "location": "Edinburgh",
    "seller_name": "Alyson Elwood",
    "member_since": "30th April 2024",
    "verified_breeder": false,
    "health_checked": true,
    "hip_scored": false,
    "elbow_scored": false,
    "eye_tested": false,
    "vaccinated": false,
    "microchipped": false,
    "wormed": true,
    "kc_registered": false,
    "original_breeder": false,
    "viewable_with_mother": false
  },
  {
    "url": "https://gundogsdirect.co.uk/dogs-for-sale/cocker-spaniels-for-sale/cocker-spaniel-puppies/30945",
    "id": "30945",
    "platform": "gundogs_direct",
    "scraped_at": "2026-01-24T20:39:04.284001",
    "title": "\ud83d\udc36 Buyer\u2019s Checklist for Gun Dogs",
    "breed": "Cocker Spaniels",
    "price": "9500",
    "posted_date": "16-12-2025",
    "posted_date_iso": "2025-12-16",
    "last_updated": "24-01-2026",
    "date_of_birth": "25 Oct 2025",
    "location": "Horsham",
    "seller_name": "George Moir",
    "member_since": "16th December 2025",
    "verified_breeder": false,
    "health_checked": false,
    "hip_scored": false,
    "elbow_scored": false,
    "eye_tested": false,
    "vaccinated": false,
    "microchipped": false,
    "wormed": true,
    "kc_registered": false,
    "original_breeder": true,
    "viewable_with_mother": true
  },
  {
    "url": "https://gundogsdirect.co.uk/dogs-for-sale/labradors-for-sale/labradors-at-stud/30943",
    "id": "30943",
    "platform": "gundogs_direct",
    "scraped_at": "2026-01-24T20:39:06.724622",
    "title": "\ud83d\udc36 Buyer\u2019s Checklist for Gun Dogs",
    "breed": "Labradors",
    "price": "650",
    "posted_date": "16-12-2025",
    "posted_date_iso": "2025-12-16",
    "last_updated": "24-01-2026",
    "date_of_birth": "4 Mar 2020",
    "location": "Gloucestershire",
    "seller_name": "Alice Hocking",
    "member_since": "1st September 2024",
    "verified_breeder": false,
    "health_checked": true,
    "hip_scored": false,
    "elbow_scored": false,
    "eye_tested": false,
    "vaccinated": false,
    "microchipped": false,
    "wormed": true,
    "kc_registered": false,
    "original_breeder": false,
    "viewable_with_mother": false
  },
  {
    "url": "https://gundogsdirect.co.uk/dogs-for-sale/springer-spaniels-for-sale/part-traind-springer-spaniels/30937",
    "id": "30937",
    "platform": "gundogs_direct",
    "scraped_at": "2026-01-24T20:39:09.309536",
    "title": "\ud83d\udc36 Buyer\u2019s Checklist for Gun Dogs",
    "breed": "Springer Spaniels",
    "price": "900",
    "posted_date": "15-12-2025",
    "posted_date_iso": "2025-12-15",
    "last_updated": "24-01-2026",
    "location": "Taunton",
    "seller_name": "Andy Vanstone",
    "member_since": "15th December 2025",
    "verified_breeder": false,
    "health_checked": false,
    "hip_scored": false,
    "elbow_scored": false,
    "eye_tested": false,
    "vaccinated": false,
    "microchipped": false,
    "wormed": true,
    "kc_registered": false,
    "original_breeder": true,
    "viewable_with_mother": true
  },
  {
    "url": "https://gundogsdirect.co.uk/dogs-for-sale/cocker-spaniels-for-sale/cocker-spaniel-puppies/30932",
    "id": "30932",
    "platform": "gundogs_direct",
    "scraped_at": "2026-01-24T20:39:11.808517",
    "title": "\ud83d\udc36 Buyer\u2019s Checklist for Gun Dogs",
    "breed": "Cocker Spaniels",
    "price": "1200",
    "posted_date": "14-12-2025",
    "posted_date_iso": "2025-12-14",
    "last_updated": "24-01-2026",
    "date_of_birth": "22 Oct 2025",
    "location": "Wakefield",
    "seller_name": "Cheryl Cutts",
    "member_since": "24th November 2025",
    "verified_breeder": false,
    "health_checked": false,
    "hip_scored": false,
    "elbow_scored": false,
    "eye_tested": false,
    "vaccinated": false,
    "microchipped": false,
    "wormed": true,
    "kc_registered": false,
    "original_breeder": true,
    "viewable_with_mother": true
  },
  {
    "url": "https://gundogsdirect.co.uk/dogs-for-sale/labradors-for-sale/part-trained-labradors/30931",
    "id": "30931",
    "platform": "gundogs_direct",
    "scraped_at": "2026-01-24T20:39:14.389583",
    "title": "\ud83d\udc36 Buyer\u2019s Checklist for Gun Dogs",
    "breed": "Labradors",
    "price": "2900",
    "posted_date": "14-12-2025",
    "posted_date_iso": "2025-12-14",
    "last_updated": "24-01-2026",
    "location": "Llanymynech",
    "seller_name": "Rebecca Evans",
    "member_since": "16th May 2024",
    "verified_breeder": false,
    "health_checked": false,
    "hip_scored": false,
    "elbow_scored": false,
    "eye_tested": false,
    "vaccinated": false,
    "microchipped": false,
    "wormed": true,
    "kc_registered": false,
    "original_breeder": true,
    "viewable_with_mother": false
  },
  {
    "url": "https://gundogsdirect.co.uk/dogs-for-sale/labradors-for-sale/labrador-puppies-for-sale/30927",
    "id": "30927",
    "platform": "gundogs_direct",
    "scraped_at": "2026-01-24T20:39:16.861365",
    "title": "\ud83d\udc36 Buyer\u2019s Checklist for Gun Dogs",
    "breed": "Labradors",
    "price": "1100",
    "posted_date": "13-12-2025",
    "posted_date_iso": "2025-12-13",
    "last_updated": "24-01-2026",
    "date_of_birth": "23 Oct 2025",
    "location": "Sheffield",
    "seller_name": "Russell Johnson",
    "member_since": "13th December 2025",
    "verified_breeder": false,
    "health_checked": false,
    "hip_scored": false,
    "elbow_scored": false,
    "eye_tested": false,
    "vaccinated": false,
    "microchipped": false,
    "wormed": true,
    "kc_registered": false,
    "original_breeder": true,
    "viewable_with_mother": true
  },
  {
    "url": "https://gundogsdirect.co.uk/dogs-for-sale/cocker-spaniels-for-sale/cocker-spaniel-puppies/30926",
    "id": "30926",
    "platform": "gundogs_direct",
    "scraped_at": "2026-01-24T20:39:19.395352",
    "title": "\ud83d\udc36 Buyer\u2019s Checklist for Gun Dogs",
    "breed": "Cocker Spaniels",
    "price": "1495",
    "posted_date": "13-12-2025",
    "posted_date_iso": "2025-12-13",
    "last_updated": "24-01-2026",
    "date_of_birth": "19 Oct 2025",
    "location": "Faringdon",
    "seller_name": "William Pidgley",
    "member_since": "13th December 2025",
    "verified_breeder": false,
    "health_checked": false,
    "hip_scored": false,
    "elbow_scored": false,
    "eye_tested": false,
    "vaccinated": false,
    "microchipped": false,
    "wormed": true,
    "kc_registered": false,
    "original_breeder": true,
    "viewable_with_mother": true
  },
  {
    "url": "https://gundogsdirect.co.uk/dogs-for-sale/cocker-spaniels-for-sale/cocker-spaniel-puppies/30920",
    "id": "30920",
    "platform": "gundogs_direct",
    "scraped_at": "2026-01-24T20:39:21.839281",
    "title": "\ud83d\udc36 Buyer\u2019s Checklist for Gun Dogs",
    "breed": "Cocker Spaniels",
    "price": "6000",
    "posted_date": "12-12-2025",
    "posted_date_iso": "2025-12-12",
    "last_updated": "24-01-2026",
    "date_of_birth": "11 Jan 2026",
    "location": "York",
    "seller_name": "Ashley Bull",
    "member_since": "12th June 2024",
    "verified_breeder": false,
    "health_checked": false,
    "hip_scored": false,
    "elbow_scored": false,
    "eye_tested": false,
    "vaccinated": false,
    "microchipped": false,
    "wormed": true,
    "kc_registered": false,
    "original_breeder": false,
    "viewable_with_mother": true
  },
  {
    "url": "https://gundogsdirect.co.uk/dogs-for-sale/labradors-for-sale/labrador-puppies-for-sale/30919",
    "id": "30919",
    "platform": "gundogs_direct",
    "scraped_at": "2026-01-24T20:39:24.513965",
    "title": "\ud83d\udc36 Buyer\u2019s Checklist for Gun Dogs",
    "breed": "Labradors",
    "price": "1000",
    "posted_date": "12-12-2025",
    "posted_date_iso": "2025-12-12",
    "last_updated": "24-01-2026",
    "date_of_birth": "16 Sep 2025",
    "location": "Hereford",
    "seller_name": "Joanne Firoozieh",
    "member_since": "24th June 2024",
    "verified_breeder": false,
    "health_checked": true,
    "hip_scored": false,
    "elbow_scored": false,
    "eye_tested": false,
    "vaccinated": false,
    "microchipped": false,
    "wormed": true,
    "kc_registered": false,
    "original_breeder": true,
    "viewable_with_mother": true
  },
  {
    "url": "https://gundogsdirect.co.uk/dogs-for-sale/labradors-for-sale/labradors-at-stud/30912",
    "id": "30912",
    "platform": "gundogs_direct",
    "scraped_at": "2026-01-24T20:39:27.148028",
    "title": "\ud83d\udc36 Buyer\u2019s Checklist for Gun Dogs",
    "breed": "Labradors",
    "price": "400",
    "posted_date": "10-12-2025",
    "posted_date_iso": "2025-12-10",
    "last_updated": "24-01-2026",
    "date_of_birth": "10 Feb 2023",
    "location": "Doddington",
